아이디,리뷰어 등급,작성 날짜,옵션1,옵션2,상품 사이즈,퀄리티,색감,키,몸무게,사이즈,리뷰내용
2F6Luhz3,,24.12.29,아이보리,FREE,정사이즈예요,아주 만족해요,화면과 비슷해요,159cm,52kg,상의 55,나름 촘촘하고 퀄리티가 생각보다 좋아서 놀랐어요 특히 핏이 상세 이미지랑 같아요! 오랜만에 마음에 드는 니트 찾아서 잘 입고 다닐 거 같아요!!
MSng2I6D,,24.12.28,아이보리,FREE,정사이즈예요,아주 만족해요,화면과 비슷해요,163cm,46kg,상의 44,"짜임이 탄탄하고 생각보다는 목이 많이 올라오지만
분홍 조거랑 아주 잘 어울려서 만족해요
자주 손이 갈거같앙ㅅ👍🏻👍🏻👍🏻👍🏻"
볶음김치좋아함,상위 5%,24.12.24,아이보리,FREE,정사이즈예요,보통이에요,화면과 비슷해요,158cm,47kg,상의 55,"보드랍고 도톰해요
옷이 여기저기 올이 나간듯 해서 뒤집어서 실 당겨서 고쳐입었어요☺️
약간 형광 노랑 느낌 나는 흰색이라 톤을 잘 맞춰입어야할거같아요ㅎㅎ"
xil56yeB,,24.12.20,아이보리,FREE,작아요,보통이에요,화면보다 어두워요,158cm,55kg,상의 55,"사진에는 엄청 하얀 것 처럼 나오는데 
실제 색은 좀 누런 아이보리라서 받고 놀랐어요 ㅋㅋㅋ 
생각보다 옷도 작고... 약간 트레이닝바지에 크롭하게 입으면 예쁠 것 같아요"
zUuNro4k,상위 25%,24.12.11,블랙,FREE,정사이즈예요,아주 만족해요,화면과 비슷해요,153cm,45kg,상의 44,"실짜임이 가격정도입니다 그래도 보풀이 엄청 심하진
않을것같아요 길이는 조금믄 더 길었어도 이쁠것같아여 뭔가 애매하게 끝나는 길이라 ㅠ그래도 이쁩니다!"
cys,,24.12.08,아이보리,FREE,정사이즈예요,아주 만족해요,화면과 비슷해요,160cm,45kg,상의 44,진짜 너무너무너무 이뻐요!!!! 옷 잘 어울린다는 말 많이 들었어요ㅎㅎ 색깔은 완전 아이보리보다 아이보리에 살구색 살짝 추가된 느낌? 아무튼 이쁩니다
rDuvNLeR,,24.12.07,네이비,FREE,정사이즈예요,아주 만족해요,화면보다 어두워요,155cm,48kg,상의 44,도톰해거 너무 좋았어요! 길이도 길지 않아서 딱 좋네요. 정전기가 좀 나긴 합니다. 이 가격에 이런 니트 사기 쉽지 않은데 잘 산거 같아용!
gjwl****,상위 25%,24.12.06,핑크,FREE,정사이즈예요,아주 만족해요,화면과 비슷해요,151cm,49kg,상의 55,"꽈배기 니트를 고민하다가 구매했는데 너무 이뻐요 ㅎㅎ 따뜻하고 너무 크지도 않고 편하고 마음에 드네용 ㅎㅎ 
다른 색상도 구매하고 싶습니당"
NJL0u8xE,,24.12.06,핑크,FREE,정사이즈예요,아주 만족해요,화면과 비슷해요,164cm,53kg,상의 55,아아 완벽해요 제가 원하던 촉감과 원하던 핏의 완벽한 니트.. 보들보들 포근하고 색깔도 딸기우유 핑크 너무 예쁘고 핏도 귀엽습니다 이거 입고 나가서 어디서 샀냐는 얘기 짐짜 많이 들었어요 재구매 의사 완전 있습니다
MaoQhfdS,상위 20%,24.12.04,아이보리,FREE,정사이즈예요,아주 만족해요,화면과 비슷해요,166cm,상의 55,,"전체적으로 골격이 큰편인데, 이런 니트들은 부해 보이기 쉬운데 생각보다 양호했습니다!! 사진 잘나오고 까슬거리지 않아 단독 착용도 ㄱㅊ했습니다"
dmst******,,24.12.04,네이비,FREE,생각보다 커요,아주 만족해요,화면과 비슷해요,163cm,52kg,상의 66,니트 진짜 예뻐요 ㅎㅎㅎ 회색 슬랙스랑 입으면 진짜 예쁠 것 같아용 퀄도 좋아서 잘 입을게요 !!! 다만 보풀이 좀 일어날 수 잇을거 같아요
nEEzJmbJ,,24.12.03,아이보리,FREE,정사이즈예요,보통이에요,화면과 비슷해요,166cm,58kg,상의 55,"완전 부드러워요!!! 저진짜 이렇게 부드러운 니트 첨이네용ㅎㅎ 이거 하나입거 겉에 코트입구 출근해도 
최고!! 그리고 핏도 너무좋고 폭닥폭닥 완전 추천"
YUT9rNOs,상위 25%,24.12.01,아이보리,FREE,정사이즈예요,보통이에요,화면과 비슷해요,164cm,53kg,상의 44,색이 좀 노래요 딱 뜯어서 봤을때 노란끼가 강해서 당황했어요. 그래도 이리저리 코디 잘하면 쿨톤도 소화할 수 있을 거 같아용 제가 찍은 사진보다도 노래요!
gpwl****,상위 25%,24.11.30,아이보리,FREE,정사이즈예요,아주 만족해요,화면과 비슷해요,161cm,55kg,상의 55,인기가 많은 이유가 있었네여!! 꼭 사세요ㅠ 안 까슬 거려서 울 함량 보단 아크릴인가 했는데 그래도 따뜻하고 핏도 예쁩니다 인기가 많은 이유가 있었네여!
ZX2KLSta,,24.11.27,아이보리,FREE,정사이즈예요,아주 만족해요,화면과 비슷해요,,,,"뭔가 살짝! 주황빛? 붉은빛이 도는 느낌이 나는데, 입을때 큰 문제는 없구영 넘~~이뻐요!! 
완전 대만족입니다 리뷰가 좋은 이유가 있는 것 같아요!"
o7j32Slp,,24.11.22,아이보리,FREE,정사이즈예요,보통이에요,화면과 비슷해요,161cm,42kg,상의 44,옷 핏이 생각보다 부하지 않고 이뻐용 따수워서 겨울에 잘 입고 다닐 것 같아요 보풀도 잘 안일어나는 것 같아용 다른 색깔도 더 쟁여놓을 예정입니다!!!
2mq42O92,상위 20%,24.11.11,핑크,FREE,정사이즈예요,아주 만족해요,화면과 비슷해요,158cm,48kg,상의 44,아니 진짜… 너무 예쁨요.. 색상 왜이렇게 잘 뽑으신거예요..? 폭닥폭닥 핑크 너무 예쁘자나 ㅠㅠㅠ 겨울에도 봄에도 가을에도 계속 입을 수 있어요 ㄹㅇ
yena1002,,24.11.08,아이보리,FREE,생각보다 커요,보통이에요,화면과 비슷해요,166cm,55kg,상의 55,"아이보리/차콜 두 컬러 샀는데 
사놓고 시간 좀 지난 다음에 입어보니까 아이보리가 늘어진건지 하단이 더 넓드라고요 
차콜에 비해 
쫀쫀함이 없었어요 반품도 안되는 시간이 지나서 걍 입으려고요ㅜㅜ
그리고 따뜻하긴한데 정전기 너무 심해요"
yarn,,24.11.07,네이비,FREE,정사이즈예요,별로예요,화면보다 밝아요,160cm,48kg,상의 55,"아따마 오랜만에 리뷰 짖게 만드네
직진으로 배송은 빠르게 잘 받았고요
첨 시착에는 생각보다 색이 좀 밝아보이네 빼곤
별 생각 안들어서 구매확정 후 다음날 입고
나가려는데 먼 쉬~불넘의 털이 날라다님 ㅡㅡ
리뷰 쓰는 지금도 주디에 털들어감;
돌돌이 해도 있고, 안에 레이어드 한 티에도 털 묻음; 파란 털도 아니라서 눈에 띄지도 않어ㅡㅡ
그리고 은사가 섞인건지 하얀 실이 같이 있어서
빛에따라 겁나 반짝거리는데 정말매우아주
저렴이스탈 ㅇㅇ 마치 비닐재질 라이더자켓
색이 밝아보인다 했더니 이런 디테일이?
상세 페이지 보니 유사품 주의 ㅋㅋㅋ 있는데
이딴걸 배껴서 팔 생각을 하는놈은 그것도 대단한 재주인데 냅두지 그러냐
데일x쥬에서 레닉스 니트 딥그린이랑 같이 샀는데 와 ㅋㅋ 재질 디자인 퀄 색감 핏 하나부터 열까지 정말정말 비교됨.. ㄹㅇ루 대단하다
하루 먼저 샀던 레나 가디건은 핏이 거지같아서 난감했는데 이 니트까지 말려든 거 보고서야 이제 보니 작년인가 재작년인가 여기 몰 1등 니트 핑크색 샀다가 개 부해보이는데 불편하기까지해서 집 앞 헌옷 수거함에 처박은 걸 내가 잊어먹었네 그건 리뷰도 안썼다..
반품은 주말꼈고 귀찮으니 리뷰만 찢고 가는데,
였그튼거 세세토록 팔아먹고 불철주야 ㅈ뺑이치길 바란다"
thf6***,상위 25%,24.11.05,아이보리,FREE,정사이즈예요,보통이에요,화면과 비슷해요,156cm,50kg,상의 55,피부가 예민해서 꺼슬거리지 않았으면 좋겠다 생각했는데 맨살에 입어도 괜찮을 정도예요! ㅎㅎ 색감도 따뜻항 느낌이라 예쁘고 추워지면 얼른 입고 나가랴구요!
wldb******,상위 30%,24.10.30,아이보리,FREE,정사이즈예요,아주 만족해요,화면과 비슷해요,155cm,45kg,상의 55,니트가 탄탄하니 아주 마음에 들어요!! 다만 색깔이 이렇게 봤을땐 아이보리지만 뭔가 햇빛 아래에 있으면 살구빛도 은은하게 도네용?!?
fZuMagKw,,24.10.26,아이보리,FREE,정사이즈예요,아주 만족해요,화면과 비슷해요,158cm,49kg,상의 44,"올 겨울 계속 입구 다닐 예정 !!!
너무 예뻐요 🤍 폭닥폭닥한 느낌 들어서 넘 좋구
실제색은 이거 보다 더 크림색에 가까워용~~~
자주 입고 다닐게요 !!!!"
필리아오,,24.09.26,아이보리,FREE,정사이즈예요,아주 만족해요,화면과 비슷해요,161cm,46kg,상의 44,"니트가 짱짱하고 이뻐요!
프리 사이즈치고는 길이는 작은 편인 것 같아요! 161인 제가 입었을 때 골반뼈 5cm밑까지 오고, 통은 넉넉하고 팔 부분도 넉넉해요!
다만 목이 짧은 저에겐 목 부분이 조금 답답하게 느껴질 수 있는 옷인 것 같아 겨울에 목도리와 함께 코디해서 입을 것 같아요:)"
수쓔,상위 20%,24.09.24,아이보리,FREE,정사이즈예요,아주 만족해요,화면과 비슷해요,163cm,48kg,상의 55,"색감에 홀려서 샀는데 흔치 않은 네이비 색이라 예뻐요!!
밑단이 넓지 않아 입울 때 살짝 끼는 느낌 있는데 허리로 살짝 올려 입기에 좋네요~
팔은 조금 깁니다!"
L8o8ZHBk,,24.09.11,아이보리,FREE,정사이즈예요,보통이에요,화면과 비슷해요,168cm,54kg,상의 44,"목이 상당히 좁긴 하지맘
긴 사람함테는 ㄱㅊ을듯
자기가 떡대있다 골격있다 하는 사람은 사지말것..
여리여리 핏은 안나옴
옷 질은 좋고 예쁨"
lYTpxStE,,24.05.08,아이보리,FREE,정사이즈예요,아주 만족해요,화면과 비슷해요,156cm,52kg,상의 66,이 가격에 대만족이예요 후기가 좋은 이유가 있네요. 완전 부드럽고 핏도 살짝 넉넉하고 두께감 꽤 있는데 예쁩니다. 겨울에 장 입을꺼같아요.
bZMPBgwK,,24.05.02,아이보리,FREE,정사이즈예요,보통이에요,화면과 비슷해요,155cm,45kg,상의 55,유튜브에서 보고 마침 할인하길래 샀어요! 낮에 입기엔 덥긴 한데 두툼하고 부드러워서 좋아요 ㅎ 키가 작은데 길이도 딱 괜찮고 예뻐요
i8r1yLci,,24.05.02,아이보리,FREE,정사이즈예요,보통이에요,화면과 비슷해요,159cm,50kg,상의 55,무난하게 입을 수 있을것 같아서 맘에 들어요. 날이 더워져서 지금 못 입어서 아쉽지만 추워지면 자주 입을 것 같아요. 바느질 문제도 없어서 좋네요. 감사합니다.
키미_kimmy,상위 10%,24.04.25,아이보리,FREE,정사이즈예요,아주 만족해요,화면과 비슷해요,165cm,49kg,상의 44,"마지막 세일가로 잘 득템 했어요 ㅎㅎㅎ,,, 살짝 노란끼 도는 크림 아이보리에요 두께도 적당해서 부해보이지 않고 뒷면은 꽈배기가 없는데 나름 괜차나요"
qWJ5AAj3,,24.04.16,아이보리,FREE,생각보다 커요,아주 만족해요,화면과 비슷해요,160cm,54kg,상의 55,"저한테는 팔이 좀 길어서 접어입었고 색은 딱 정확헤 제가 원한느낌의 크림화이트색..?입니다!
제가 살짝 통통해서 그런가 조금 부해보이는 느낌이 있지만 전혀 까슬거리지 않고 좋아요"
a2rb9E2r,,24.04.03,아이보리,FREE,정사이즈예요,아주 만족해요,화면과 비슷해요,165cm,60kg,상의 66,"딱 겨울용 포근한 니트에요!
아이보리 색감 잘 나왔고 패턴도 귀여워요!
겨울 끝나갈때 사서 얼마 못입어서 아쉽지만 추워지면 열심히 입고 다녀야겠어요!"
R9hZVhZE,상위 15%,24.03.24,아이보리,FREE,정사이즈예요,아주 만족해요,화면과 비슷해요,161cm,55kg,상의 66,적당히 포근하고 길이도 적당해서 좋았어요. 색상도 누런끼 많이 없어서 좋았습니다. 다만 패턴 때문인지 약간 부해 보이는 느낌은 있어요!
PKaXwzBZ,,24.03.21,아이보리,FREE,정사이즈예요,보통이에요,화면과 비슷해요,160cm,45kg,상의 44,"입흐네요
생각보다 핏이.. 넉넉하지 않구 재질이 좀..그닥?
보풀 많이 생길 것..같은 느낌...관리 잘 해줘야될거같아요 그냥... 머 무난하게 입기 좋았어요"
6SzaAmEc,,24.03.16,아이보리,FREE,정사이즈예요,보통이에요,화면과 비슷해요,160cm,60kg,상의 66,"옷 진짜 예뻐요
질감도 좋구요 ❤️
문제는 제 몸뚱아리 ,, ^^;
소재, 디테일 다 완벽입니다
입었을 때 까끌한 느낌 전혀 없어요 !"
nanao,,24.03.16,아이보리,FREE,정사이즈예요,아주 만족해요,화면과 비슷해요,163cm,48kg,상의 44,"따뜻하고 꽤배기 짜임도 예뻐서 요새 일주일에 2-3번은 입고 있어요!!
색깔도 따뜻한 아이보린데 노란기 많이 돌지 안ㄹ아서
딱 적당히 화사해요 ㅎㅎㅎ"
ujicNL4u,,24.03.12,아이보리,FREE,정사이즈예요,아주 만족해요,화면과 비슷해요,161cm,55kg,상의 66,부들부들 해서 너무 좋아요... 사이즈도 넉넉하니 잘입을께요...길이도 팔을 올려도 적당해서 좋아요...두꺼울까 걱정했는데 딱적당해서 만족합니다..
eqAMbNl4,상위 15%,24.03.10,아이보리,FREE,정사이즈예요,보통이에요,화면과 비슷해요,158cm,45kg,상의 55,따뜻하고 예뻐요 !! 츄리닝에도 꾸꾸룩에도 여기저기 잘 입을 수 있을 거 같아요 색은 화면에서 보이는 거랑 비슷한 아이보리 색이고 딱 예쁜 핏이에요
Teg3wzgQ,,24.03.09,아이보리,FREE,정사이즈예요,아주 만족해요,화면과 비슷해요,160cm,51kg,상의 55,1위하는 이유는 항상 있어요 ෆ 짜임도 이쁘고 아이보리 색감이라 어느 룩이든 코디하기에 따라서 좋아요🥴 부풀나기 보다는 잔털이 빠진 듯하는?
PBFsnPc5,,24.03.08,아이보리,FREE,정사이즈예요,아주 만족해요,화면과 비슷해요,160cm,47kg,상의 55,"배송 하루만에 왔어용
후기도 좋고 할인도 하길래 구매했어요
꽈배기 패턴도 예쁘고 도톰하고 부드러워요!!
맨살에 입어도 안따갑고 핏 너무 예뻐여
가성비 체고🩷"
dfyARwrX,,24.03.07,아이보리,FREE,생각보다 커요,보통이에요,화면과 비슷해요,156cm,51kg,상의 55,넥라인이 답답하고 길이가 애매해요! 까슬거리지 않아서 단독으로 입어도 괜찮긴 해서 좋았어요! 엄청 마르신 분들 아니면 여리여리한 느낌 나는 니트는 아닙니다!
N7xhJVx9,상위 15%,24.03.07,아이보리,FREE,정사이즈예요,아주 만족해요,화면과 비슷해요,157cm,44kg,상의 55,"이가격에 이퀄리티 말이 안되네요
포근포근하니 봄에도 단품으로 잘 입어질것같아요
까슬거림 하나도 없어 좋아요
근데 뒷면이 무늬가 없어서 좀 웃기긴해요 :)"
219iMFNJ,,24.03.06,아이보리,FREE,정사이즈예요,아주 만족해요,화면과 비슷해요,167cm,60kg,상의 66,두툼한 니트의 정석이에요 기장 소재 가격 다 마음에 들어요 아이보리 말고 완전 화이트 색상도 나왔으면 좋겠어요 치마 바지 다 잘어울려요
jVTzBGcY,상위 10%,24.03.05,아이보리,FREE,정사이즈예요,아주 만족해요,화면과 비슷해요,165cm,58kg,상의 55,디자인이 귀엽습니다. 부해보이는 것 같긴 하면서도 귀엽고 품질이 좋아서 만족합니다 아이보리색이긴한데 그래도 얼굴색이 노래보이지 않는 갓 같아요~
DlBmMOuj,상위 25%,24.03.05,아이보리,FREE,생각보다 커요,보통이에요,화면과 비슷해요,156cm,46kg,상의 55,유툽 보고 샀는데 도톰하고 부드러운 재질이예요 밑단 시보리가 흘러내리는 재질이라 조금 아쉽긴한데 ㅠ 좀만 더 짱짱했으면 좋았을것같아요
hUnILHQx,상위 25%,24.03.05,네이비,FREE,정사이즈예요,보통이에요,화면과 비슷해요,164cm,50kg,상의 44,뭔가 애매해요 ㅠㅜ키가 163인데 길지도 짧지도 않은 길이고 부해보여오 ㅠㅠㅋㅋ 색은 무난하게 예쁜 겋 같아서 그냥 입으려구요 퀄도 그렇게 좋진 않아요
돈없어서빤스만입음,,24.03.03,아이보리,FREE,정사이즈예요,아주 만족해요,화면과 비슷해요,158cm,47kg,상의 44,꽈베기 니트 하나 갖고 싶어서 샀는데 넘 마음에 들어오!! 니트 짜임 모양도 예쁘고 두께도 딱 봄 가을 겨울 입기 좋은 것 같아용ㅎㅎ 넘 포근해보이는 옷입니닷
GLfZiL4V,,24.03.02,아이보리,FREE,정사이즈예요,아주 만족해요,화면과 비슷해요,158cm,49kg,상의 44,"엄청 도톰하고 따뜻하고 예뻐요 !! 물론 생각했던 것 보다 넥라인이 좀 작고 꽉 맞는 느낌이었어요
목이 짧은 사람이 입으면 살짝 답답해보일 것 같긴합니다"
o6rne40L,,24.03.01,아이보리,FREE,정사이즈예요,보통이에요,화면과 비슷해요,158cm,48kg,상의 55,디자인이 예쁘고 소재가 부드러워서 좋아요! 다만 저한테는 길이가 조금 길어서 접어입어야하는데 밑단이 약간 헐렁해서 아쉬워요 그래도 예쁘니까 잘 입겠습니당🙂
BS8mCaiU,,24.03.01,핑크,FREE,정사이즈예요,아주 만족해요,화면과 비슷해요,157cm,50kg,상의 55,제가 봄웜톤인데색상이 화사한 핑크 톤이라 얼굴을 밝혀주는 기분이 듭니다 재질은 니트인데도불구하고 보풀이 잘 안날 거 같아서 좋아요 맘에 듭니다
AdKxhHfJ,상위 5%,24.02.29,네이비,FREE,생각보다 커요,보통이에요,화면과 비슷해요,170cm,58kg,상의 55,어깨가 좀 있는편인데 부해보이고 어깨쪽 통이 넓어서 안이뻐 보여요ㅜㅜ 엄청 별로는 아니지만 그래도 좀 아쉽네요 패턴도 적당히 있으면 좋았을텐데
m1Ge5ZHp,상위 30%,24.02.29,아이보리,FREE,정사이즈예요,아주 만족해요,화면과 비슷해요,158cm,50kg,상의 55,"꽈배기 짜임도 너무 이쁘고 
색감이며 입었을때도 까끌거리지 않아 너무 만족스러워요 :) !!!
이가격에 이 퀄리티라니 다들 당장사셔요!"
Ci8BZP2u,,24.02.28,아이보리,FREE,정사이즈예요,보통이에요,화면과 비슷해요,152cm,53kg,상의 55,"예뻐요 !!! 꽈배기 니트 하나 입고싶었는데 딱 좋아요
아이보리라서 빨리 더러워 질거같긴하지만 예뻐서 괜찮아요 옷이 부드러워서 입기 좋네요"
lhaqq1uX,상위 20%,24.02.27,아이보리,FREE,정사이즈예요,보통이에요,화면과 비슷해요,164cm,58kg,상의 55,"하얀색이 너무 이쁘고 입으면 폭닥폭닥한
느낌이 들어 그냥 니트만 입어도 넘 이뻐용
길이도 너무 짧지도 않고 길지도 않아
그냥 막입기 좋아요"
GAlhArum,,24.02.27,아이보리,FREE,정사이즈예요,보통이에요,화면과 비슷해요,157cm,48kg,상의 55,"딱 상상가는 그런 느낌이에요. 살짝 성글게 짜여진 느낌이에요. 가격이 저렴하니 감안하려구요. 
한 철 입기에 딱 좋을 것 같아요. 아이보리 컬러에 짜임도 예쁩니다."
xtFmrhNp,상위 25%,24.02.25,아이보리,FREE,정사이즈예요,아주 만족해요,화면과 비슷해요,165cm,53kg,상의 55,"꽈배기 패턴은 이런느낌입니다! 너무 예뻐요. 아이보리 색도 너무 예쁘고 핏도 훌륭합니다,, 웜톤은 입었을때 정말 편안~~~한 톤이에요!"
wanu_s,,24.02.25,차콜,FREE,정사이즈예요,아주 만족해요,화면과 비슷해요,156cm,51kg,상의 55,진짜 폭닥폭닥하고 따뜻해서 이젠 못입지만 겨울 지나기전에 입어본 걸로 만족합니다! 색도 예쁘고 길이감도 만족스러운데 단점은 털이 빠져요 그리고 니트라 그런지 올이 살짝 잘 빠집니다
pqPyogyD,,24.02.24,아이보리,FREE,정사이즈예요,아주 만족해요,화면보다 어두워요,168cm,58kg,상의 55,"아이보리이긴한데 약간노란끼 있는 니트 같아여 
사진보다 좀더 노란끼있어요 근데두툼하고 168센치 한테 크롭은아니고 또길지도않은 골반선 정도에요! 길이감좋아서 만족해요!"
MBPpYZ2D,,24.02.20,아이보리,FREE,정사이즈예요,아주 만족해요,화면과 비슷해요,164cm,50kg,상의 44,"핏 색 퀄리티 너무너무 좋아요 웜톤한테 딱이에요 
근데 보풀이 금방 날 것도 같아서 아쉽지만ㅜㅜ 한철입고 무조건 또 살거예요 넘이뻐요"
ymM8p5ib,상위 30%,24.02.19,핑크,FREE,정사이즈예요,보통이에요,화면과 비슷해요,170cm,58kg,상의 66,"색감이 너무 따뜻하고 촉감도 보들보들한 편이에요
다만 조금 아쉬운 건 니트 소재상 어쩔 수 없긴 하지만 보풀은 잘 일어나는 편이네요ㅠ"
wEHxW2cQ,,24.02.19,아이보리,FREE,정사이즈예요,아주 만족해요,화면과 비슷해요,154cm,50kg,상의 55,아이보리에 좀 두터운 재질이라 부해보이는건 맞는데 얼굴 환하게 만들어주고 재질도 보들보들해서 만족해요 ! 아이보리 꽈배기 니트 찾으시는 분들 추천합니당
podo******,,24.02.18,네이비,FREE,생각보다 커요,보통이에요,화면과 비슷해요,160cm,49kg,상의 55,품이 엄청 커서 부해보이긴 하지만 추울 때 따뜻하게 입을 수 있겠어요 도톰하고 편하게 입기 좋아요 보풀이 잘 생길 거 같아서 관리를 잘 해야겠어요 길이는 딱 좋아요~
sall*****,상위 15%,24.02.16,핑크,FREE,작아요,보통이에요,화면과 비슷해요,,,,생각보다 도톰해서 따뜻해요😊 근데 제가 어깨가 넓어서 그런지 몰라도 부해보였어요 .. 뭔가 덩치가 조금은 있어보이는 느낌이었지만 색깔이 넘 예뻐요
k7GQRZ1U,,24.02.16,네이비,FREE,정사이즈예요,아주 만족해요,화면과 비슷해요,160cm,55kg,상의 55,네이비 컬러 엳시 예븜. 핏도 크롭하면서도 아방하니 입기 딱이엇음. 목도 쫀쫀해서 안 늘어날 것 같음. 평소에 휘뚤마뚤 잘 입고 다닐것 같아서 만족
UnbKh566,,24.02.16,아이보리,FREE,정사이즈예요,아주 만족해요,화면과 비슷해요,165cm,56kg,상의 55,니트가 아무래도 많이 두꺼워서 좀 부해보이긴 해요 그래도 치마랑 입으면 덜 부해보여서 괜찮더라구요 옷 자체는 이뻐용 색도 너무 노란기 안돌아서 좋아요
kjVPW5bM,,24.02.14,아이보리,FREE,정사이즈예요,아주 만족해요,화면과 비슷해요,160cm,45kg,상의 55,"오픈하자마자 만족했어요 너무 예뻐서요
재질도좋구요 화면과 색상도 똑같아요 꽈배기니트 여러군데 고민하다가 구매했는데 
너무나도 만족스럽고 예쁩니다"
TFcsxSz2,,24.02.13,네이비,FREE,정사이즈예요,보통이에요,화면과 비슷해요,168cm,66kg,상의 66,질이 그렇게 좋은 편은 아니에요 살짝 부직포 같은 느낌이 있어요 할인 받아서 이만원 후반대류 샀는데 딱 그 가격 같아요 할인 안받은 금액이였으면 별로 였을거같습니다
JhinYCiF,,24.02.13,네이비,FREE,정사이즈예요,보통이에요,화면과 비슷해요,165cm,53kg,상의 55,엄청 탄탄해요 ㅋ 목부분이 불편하긴 한데 오래 입을 수 있을 구 같아용 길이도 165기준 반크롭 기장이라 좋아요 벗을 때 정전기가 많이 나긴 합니당
elz6CD11,,24.02.13,네이비,FREE,정사이즈예요,보통이에요,화면과 비슷해요,170cm,58kg,상의 66,"보풀 잘 일어날 것 같은 재질!! 이지만 전체적인 핏이나 꽈배기 모양이 넘 마음에 들어요 ㅋㅎㅎ
170 기준 엉덩이 바로 위까지 오는 길이에요."
XO9q8dkz,,24.02.13,아이보리,FREE,정사이즈예요,보통이에요,화면과 비슷해요,155cm,48kg,상의 55,털빠짐은 좀 있지만 배송도 빠르구 무난하게 휘뚤마뚤하게 입을수 있을거 같은 니트예요! 겨울에는 안에 이너티 입고 입으면 될거 같고 봄에도 스커트에 입으면 예쁠듯 합니당 만족해요 !
ztHqfk6L,,24.02.09,아이보리,FREE,정사이즈예요,아주 만족해요,화면과 비슷해요,,,,"폭닥폭닥하고 부드러워서 좋아요!! 
꽈배기 무늬도 예쁘고 색상이 살짝 노란기가 도는데 오히려 맘에 듭니당,, 앞으로 잘 입고 다닐 듯ㅎ"
FLaps7Q9,,24.02.09,아이보리,FREE,정사이즈예요,아주 만족해요,화면과 비슷해요,155cm,43kg,상의 55,"너무 마음에 들어서 일주일에 몇번을 입는지 몰라요 ㅠㅠ
도톰하고 아이보리 색상이지만 털 날림 하나도 없어요!!
기장도 적당해서 네이비도 구매할 예정입니다🤍"
wnETUJcA,,24.02.08,아이보리,FREE,정사이즈예요,아주 만족해요,화면과 비슷해요,154cm,41kg,상의 55,케이블 니트가 유행이래서 샀는데 일단 제일 맘에드는건 색감이에요 ㅎ ㅎ 포근포근해서 예뻐요 오래 기다ㅕ서 받았는데 인기많은 이유가 있네여
YIINNyN3,,24.02.08,아이보리,FREE,정사이즈예요,보통이에요,화면보다 어두워요,,,,"사진과 다른 컬러의 아이보리라 배송 받고 잠시
당황했어요ㅠㅠ 노란끼가 많이 도는 아이보리입니다 핑크랑 고민했는데 그냥 핑크 살껄 그랬나봐요. 소재는 도톰하고 부드러워서 좋아요."
L2w9GEWJ,,24.02.08,아이보리,FREE,정사이즈예요,보통이에요,화면과 비슷해요,,,,직잭 1등 니트 한번 구매해봤슴니다 길이는 보통인거같고 목부분이 좁은게 특징인거같습니다 재질도 좋아요 꽈배기 무늬가 뒷부분에는 없습니더 ㅎ
