아이디,리뷰어 등급,작성 날짜,옵션1,옵션2,상품 사이즈,퀄리티,색감,키,몸무게,사이즈,리뷰내용
adTZng3I,,23.04.11,블루그레이,,정사이즈예요,보통이에요,화면과 비슷해요,165cm,51kg,상의 55,색감이 아주 맘에 들어요! 블루 그레이라는 이름에 맞게 그레이 같지만 블루가 도는! 얼핏보면 회색 많이 섞인 연보라 같기두 하네용
mNLWJDZV,,23.04.09,살구핑크,,정사이즈예요,보통이에요,화면과 비슷해요,167cm,56kg,상의 66,색도 이쁘고 핏도 이쁘네용ㅎㅎㅎ 살만 더 빼서입으면 완벽할거 같아용~ㅐ~~!!! 봄가을에 입기 좋구 겨울에 아우터랑 입기에더 좋아유
5gJcvkLt,,23.04.08,블랙,,정사이즈예요,보통이에요,화면과 비슷해요,199cm,99kg,상의 33 이하,배송이 좀 늦었는데 예뻐요 ㅎㅎ 블루그레이도 구매했어요!! 지금 날씨에 입기 딱 좋은거 같네용 굿굿 잘 입을게옹 옙버용
HPztRuWR,,23.04.08,블루그레이,,정사이즈예요,보통이에요,화면과 비슷해요,163cm,52kg,상의 55,핏도 예쁘고 퀄리티도 좋아요 봄에 입기 딱 좋아서 다른 색상으로 더 구매하고 싶어요 메이드 제품은 믿고 삽니다 ...! 최고
skad**,,23.04.08,라이트퍼플,,정사이즈예요,보통이에요,화면과 비슷해요,,,,색감은 예쁘고 화면이랑 같은데 배바지를 했을 때가 너무 안 예뻐요 ㅠㅠ 자연스럽게 빠지는게 아니라 뱃살처럼 둥그렇게 나옵니다..
o0btpKDr,,23.04.05,블루그레이,,정사이즈예요,아주 만족해요,화면과 비슷해요,165cm,60kg,상의 66,전에 다른색 구매하고 만족스러워서 또 구매했어요 봄에 입기 너무 좋고 팔도 길어서 여리여리해 보여요 색별로 구매할 것 같아요
klHPxQwH,,23.04.04,아이보리,,정사이즈예요,보통이에요,화면과 비슷해요,163cm,56kg,상의 55,"생각보다 핏도 널널하고
재질도 괜찮은거 같아요
연보라 추가구매하려고요 ㅎㅎ 추천합니당 ~~
봄에 입기 딱 좋아요 !!!"
VAoMT6zm,상위 30%,23.04.03,블루그레이,,정사이즈예요,아주 만족해요,화면과 비슷해요,162cm,49kg,상의 55,"색감 예쁜 블루그레이에요 제가 올린 사진보다 파란끼가 더 있고, 블루+그레이 둘다 섞여있는 예쁜 색입니다~ 하늘하늘 예뻐요"
K7sYCXG7,,23.04.03,라이트퍼플,,생각보다 커요,보통이에요,화면보다 어두워요,159cm,47kg,상의 44,색상이 생각했던 것보다 좀 더 어두운 라벤더색이라 아쉽네요 통이 더 좁으면 좋을 것 같아요 무난해서 잘 입고 다닐 것 같습니다
UcpisCeq,상위 15%,23.04.01,블루그레이,,정사이즈예요,아주 만족해요,화면보다 어두워요,,,,품이 넉넉하지만 핏이 예쁘고 옷 촉감도 좋아요 다만 색상이 거의 그레이에 가까워서 블루가좀더 섞였다면 좋았을거같아요
wX4JGIMq,,23.04.01,블루그레이,,정사이즈예요,아주 만족해요,화면과 비슷해요,165cm,60kg,상의 66,"좋아요 색감 재질 모두만족합니다
깔별로구매했네요
색깔 다양한 기본템 찾기힘든데 색깔이 다양해서 좋아요
입어보고 또살게요"
wX4JGIMq,,23.04.01,라이트퍼플,,정사이즈예요,아주 만족해요,화면과 비슷해요,165cm,60kg,상의 66,"좋아요 색감 재질 모두만족합니다
깔별로구매했네요
색깔 다양한 기본템 찾기힘든데 색깔이 다양해서 좋아요
입어보고 또살게요"
wX4JGIMq,,23.04.01,블랙,,정사이즈예요,아주 만족해요,화면과 비슷해요,165cm,60kg,상의 66,"좋아요 색감 재질 모두만족합니다
깔별로구매했네요
색깔 다양한 기본템 찾기힘든데 색깔이 다양해서 좋아요
입어보고 또살게요"
uq1Jfs0C,,23.03.31,블루그레이,,정사이즈예요,보통이에요,화면과 비슷해요,160cm,50kg,상의 44,"색깔도 예쁘고 핏도 예쁘고 두께감도 좋은데
한번 빨았더니 목 부분이 튿어졌어요..
꼬맸는데도 저래요.. 그냥 입긴 합니다ㅠㅠ"
굼웅가기,,23.03.30,블랙,,정사이즈예요,아주 만족해요,화면과 비슷해요,156cm,44kg,상의 33 이하,기본템으로 좋아요 요즘같은 날씨에 입기에 딱 맞는 옷인거 같아요 소매가 길어서 한단 접어서 입으니까 제몸에 맞고 좋네요 ^_^
p0pdSaAb,,23.03.30,아이보리,,정사이즈예요,보통이에요,화면과 비슷해요,160cm,47kg,상의 55,작년에 사서 잘 입고다녀서 재구매합니다 적당한 핏에 여기저기 받쳐입기 좋아요 같은 컬러 같은 재질로 반팔버젼도 나왔으면 좋겠네용
rmT0FcAw,,23.03.30,아이보리,,정사이즈예요,보통이에요,화면과 비슷해요,143cm,30kg 이하,상의 55,… 생각보다 흰색이 아니라 누런 아이보리 느낌이 강해서 색감은 별로였어요 근데 핏은 좋아서 잘 입으려구요 헤헤……….
N7Svt0Ip,상위 10%,23.03.29,블루그레이,,정사이즈예요,보통이에요,화면과 비슷해요,,,,"핏이 진짜 이쁜거같아요!
두가지 색상 구매했는데, 아이보리색이 더 예쁜거같네요
색 매칭하기도 좋고 편하네요
추천해요"
N7Svt0Ip,상위 10%,23.03.29,아이보리,,정사이즈예요,보통이에요,화면과 비슷해요,,,,"핏이 진짜 이쁜거같아요!
두가지 색상 구매했는데, 아이보리색이 더 예쁜거같네요
색 매칭하기도 좋고 편하네요
추천해요"
IH7PXjjd,,23.03.29,아이보리,,정사이즈예요,보통이에요,화면과 비슷해요,,,,검정 잘 입어서 아이보리도 구매했어요! 안에 이너 신경써서 입어야할 거 같아요! 다 비치더라구요~ 그리고 뭔가검정보다 더 까끌한 느낌?
2NfPmcUW,,23.03.29,아이보리,,정사이즈예요,보통이에요,화면과 비슷해요,166cm,49kg,상의 55,"생각보다 얇아서 아쉽긴한데 이뻐서 데일리로 많이 입고 다녀요 
다른 색도 구매하고싶네요 봄에 많이 입어둬야겠어요!!"
jzmIZknZ,상위 20%,23.03.26,블루그레이,,정사이즈예요,아주 만족해요,화면과 비슷해요,165cm,57kg,상의 55,배송이 너무 오래걸려서… 많이 아쉽긴 하지만 ㅠㅠ 제품 자체는 만족스럽습니다! 쿨톤인 사람에게 딱인 것 같아요 :) ㅎ
sPB6rePX,상위 30%,23.03.26,블루그레이,,정사이즈예요,아주 만족해요,화면과 비슷해요,167cm,53kg,상의 55,"가격대비 높은 퀄리티의 제품이에요
겨울에 블랙 구매했어서 이번엔 아이보리 그레이 추가 구매해용
너무 예쁘고 핏도 최고입니다!"
U2etZkhJ,,23.03.26,블루그레이,,생각보다 커요,아주 만족해요,화면과 비슷해요,157cm,45kg,상의 44,색상 화면이랑 똑같고 옷 재질도 안 까끌거려서 좋아요 근데 팔이랑 몸통부분 통이 좀 커서 핏이 애매해요 이거 빼면 다 좋아요
vivi****,상위 15%,23.03.25,블랙,,정사이즈예요,아주 만족해요,화면과 비슷해요,158cm,48kg,상의 44,완전 기본템이에요! 사이즈도 붙지 않고 넉넉한 핏으로 나와서 출근할 때 딱 좋아요ㅎㅎ 봄까지 아주 잘 입을 것 같습니다~
8MSlGkc2,상위 30%,23.03.23,라이트퍼플,,정사이즈예요,보통이에요,화면과 비슷해요,158cm,48kg,상의 55,봄에 입으려고 샀는데 색깔도 이쁘고 핏도 이쁩니다 !! 세일할때 사서 가성비있게 샀어요 짱입니다 다들 사세요 추천합니다
9fgGjPru,,23.03.20,블랙,,정사이즈예요,아주 만족해요,화면과 비슷해요,163cm,50kg,상의 55,"여기저기 받쳐입기 좋은 니트예요
팔 기장도 적당히 길어서 이너로 입기 좋습니당
블랙 색상이라 더 날씬해 보이는 것 같아요"
eQTMw97R,,23.03.19,블랙,,정사이즈예요,보통이에요,화면과 비슷해요,160cm,50kg,상의 55,"여기저기 받쳐입기좋아 블랙으로 구매했는데
몸에 너무 딱붙지않아 오히려 좋았어요
조금 탄탄한 재질이고 먼지가 잘붙는것빼면
괜찮습니다"
FKfeRwwe,상위 25%,23.03.16,블루그레이,,정사이즈예요,보통이에요,화면과 비슷해요,160cm,60kg,상의 66,사진보다 살짝 어두운데 이쁜 컬러에요! 생각보다 딱 맞는 사이즈지만 그래도 날씬해보이는 핏 입니다 봄에 편하게 잘 입을듯!
clif******,,23.03.16,블루그레이,,정사이즈예요,보통이에요,화면과 비슷해요,162cm,54kg,상의 55,블루그레이 색감 너무 예뻐요!!! 배송이 오래 걸리긴 했지만 그거 감안해도 맘에 듭니당 핏도 적당히 슬림핏이고 좋아요
xouy6PES,,24.10.09,블랙,,정사이즈예요,아주 만족해요,화면과 비슷해요,,,,되게 고급스럽고 소재가 맘에 들어요! 입었을때 길이가 조금 긴데 바지에 넣어입으면 이쁠거같아요! 착용감도 몸에 딱감겨서 좋네요
FwK4GPsU,상위 30%,24.09.25,블랙,,생각보다 커요,보통이에요,화면과 비슷해요,168cm,56kg,상의 55,"오래 입을 재질은 아니고 한 두 해 정도 막 입기 좋아보여요.
새옷인데 뭔가 반들하게 보이는 부분이 있는걸 보면…
사이즈는 같이 산 블루그레이보다 좀더 크네용"
OfosN5up,,24.03.06,라이트퍼플,,생각보다 커요,보통이에요,화면과 비슷해요,156cm,43kg,상의 44,색깔은 너무 이쁜데 처음에 딱 받고 너무 얇아서 놀랐어요..ㅎㅎ~ 근데 꽃 필때 입고 사진 찍으면 넘 잘나올 것 같네염~ 늦봄?에 입으면 좋을듯
vcDiv3NM,,23.11.25,블루그레이,,생각보다 커요,아주 만족해요,화면과 비슷해요,164cm,50kg,상의 55,"휘뚤 마뚤 너뮤 좋아요 잘 늘어나지 않고 탄탄해요
다만 보풀이 잘 생겨 매년 새로 사고 있어요! 
포불 관리만 잘해주면 오~래 입을수 있어요"
yYl0CKhz,상위 5%,23.10.16,아이보리,,생각보다 커요,아주 만족해요,화면과 비슷해요,158cm,55kg,상의 55,"배송이 너무 늦었지만,, 만족하는 이너입니다. 사이즈도 다른 후기처럼 생각보다 커서 입을만하구요. 너무 내복같지 않아서 다행입니다 ㅎㅎ 잘 입을게요!"
dZMb1BdY,,23.05.12,아이보리,,정사이즈예요,보통이에요,화면과 비슷해요,162cm,46kg,상의 44,살짝 노란 빛깔 도는 색이에요! 웜톤 분들은 예쁘게 입으실 수 있을 것 같습니당 밝은 색상이다보니 안에 속옷을 신경 써서 입어야 할 듯 조금 비쳐요
8Ha3HYqj,,23.05.09,아이보리,,정사이즈예요,보통이에요,화면과 비슷해요,,,,퀄리티도 좋고 색깔도 사진그대로예요!! 다만 제가 팔이 좀 짧아서 그런지 팔이 좀 기네옹 ㅠㅠ ㅎㅎㅎ 그래듀 이쁩니다 👍🏻👍🏻
CzQz3CgS,상위 1%,23.05.01,아이보리,,생각보다 커요,보통이에요,화면과 비슷해요,162cm,44kg,상의 44,"배송 공지가 너무 길어서 문의했는데 오래걸린다고
해서 주문하고 고민했는데 2틀만에 왔어요 
사이즈가 좀 루즈해요 
가격정도의 가성비 니트에요"
eyE1XLaC,,23.04.21,아이보리,,정사이즈예요,보통이에요,화면과 비슷해요,158cm,58kg,상의 55,"잘구겨져요 
근데 다림질하면 괜찮음
비침이 심해서 무조건 안에 나시입어야함
사실 그걸 따 떠나서
살 빼고 입어야될 핏이에요 ㅎㅎ
살 빼고 입어보겠습니다"
TVIkafgI,상위 15%,23.04.16,블루그레이,,정사이즈예요,보통이에요,화면과 비슷해요,162cm,48kg,상의 44,"배송은 생각보다 많이 느렸어요 ㅠㅠ
기본이라 여기저기 잘 입을 것 같구요
지금 입기 딱 좋아요 ㅎㅎ 더워지기전에 열심히 입어야겠네용 ㅎㅎ"
sTLA8Z0W,상위 10%,23.04.06,블루그레이,,생각보다 커요,보통이에요,화면과 비슷해요,,,,"뭐랄까 허리선이 살~짝만 들어가 있었으면 더 말라 보이게 해줄거 같아요 왜인저 검정보다 블루그레이기 더 예뻐보여요 ㅋㅋ
빼서 입는것보단 바지에 넣어입는개 예뻐요"
jYheBEXx,상위 25%,23.04.04,아이보리,,정사이즈예요,보통이에요,화면과 비슷해요,161cm,55kg,상의 55,봄에 입기 적당한 두께이고 너무 딱 달라붙지 않아서 좋아용 내복같으면 어쩌나 걱정했는데 다행히 그냥 니트같습니다! 기장 살짝 애매하긴 한데 대충 넣어입으면 될것같아여
KVyROlZZ,,23.03.29,블랙,,정사이즈예요,보통이에요,화면과 비슷해요,159cm,53kg,상의 55,"쫀쫀하고 편하고 이뻐요!!
하의 아무거나 매치해도 다 잘 어울리고 자켓 안에 이너로 입기에도 딱 입니당!!!
너무 잘 산 것 같아요 ㅎㅎㅎ"
KVyROlZZ,,23.03.29,아이보리,,정사이즈예요,보통이에요,화면과 비슷해요,159cm,53kg,상의 55,"쫀쫀하고 편하고 이뻐요!!
하의 아무거나 매치해도 다 잘 어울리고 자켓 안에 이너로 입기에도 딱 입니당!!!
너무 잘 산 것 같아요 ㅎㅎㅎ"
jzmIZknZ,상위 20%,23.03.26,라이트퍼플,,정사이즈예요,아주 만족해요,화면과 비슷해요,165cm,57kg,상의 55,사진은 실제랑 색감이 너무 다르게 나왔어요ㅠ 쇼핑몰 사진 색ㄱ감이랑 똑갘습니다! 봄에 가볍게 단독으로 입어도 좋고 자켓이랑 같이 입어도 이뻐요 :)
79as***,,23.03.23,아이보리,,정사이즈예요,아주 만족해요,화면과 비슷해요,159cm,48kg,상의 44,봄에 잘 입을 거 같은 기본 니트에요 ㅎㅎ 두껍지 않고 하늘하늘한 기본 니트! 다른 색도 기본템으로 몇개 더 구매해볼까 고민이에용 ㅎㅎ
O2GHQEv7,,23.03.22,아이보리,,정사이즈예요,아주 만족해요,화면과 비슷해요,160cm,57kg,상의 55,"기대이상으로 몸에 딱 맞고 질감도 좋아요.
평소 청바지를 잘 입는데 청바지랑도 잘 어울리고 치마랑 입어도 이쁘더라구요. 다른 색상으로 또 구매했어요"
DdjCDKKS,,23.03.20,블루그레이,,정사이즈예요,보통이에요,화면과 비슷해요,,,,크게 기대하지 않고 구매했는데 색감이 정말 예뻐요 여름 뮤트인데 다른 옷들 입다가 이 옷 입으면 얼굴 색이 살아나는게 눈에 띄게 보여서 만족스럽습니다!
GffvuVYx,상위 25%,23.03.19,블루그레이,,정사이즈예요,보통이에요,화면과 비슷해요,154cm,44kg,상의 44,우왕 너무 기본 티인데 활용도가 너무 높아요! 스카이 색깔 너무 맘에 들고 ㅎㅎ 아래 청바지던 치마든 잘어울려요 ~~~하나더 살까 고민이에요
0XcpfraV,,24.06.23,블루그레이,,정사이즈예요,아주 만족해요,화면과 비슷해요,,,,이름은 블루그레인데 그레이에 많이 가깝긴 합니다 오묘한 색이에요ㅋㅋ 다른색 먼저 사고 맘에 들어서 재구매했습니다 손이 잘가요
d797*,,24.03.29,아이보리,,생각보다 커요,보통이에요,화면보다 어두워요,158cm,52kg,상의 55,"좀 누런 베이지컬러 같아요
웜톤에게 잘 어울릴 컬러..?
길이도 생각보다 기네용
그래도 기본티 정도로 하나쯤 갱차나여"
ktwyFh1q,,24.03.09,블랙,,정사이즈예요,보통이에요,화면과 비슷해요,166cm,52kg,상의 55,무난합니다~~~ 검정 두개사서 엄마랑 저랑 입었는데 엄마가 하나더 사주라네요 세탁해도 변형이 없어서 맘에 들어하십니디
생갈치1호의행방불명,상위 25%,24.02.20,블랙,,정사이즈예요,아주 만족해요,화면과 비슷해요,156cm,58kg,상의 55,"청바지에 입어도 잘 어울리구 뭔가 통통했던 제 몸을 ,, 안 통통하게 만들어주는 마법같은 옷 ...! 배송 늦을까봐 걱정 했는데 금방 오더라구요 ㅎ 생각보다 얇지 않아서 쌀쌀한 날씨에도 괜찮았어용"
sdb7***,상위 25%,24.02.01,블루그레이,,정사이즈예요,아주 만족해요,화면과 비슷해요,163cm,53kg,상의 55,파란색 예전에 샀다가 퀄리티가 너무 좋아서 그레이도 샀어요! 색상은 실제로 보면 살짝 밝은 색인데 상세페이지랑 비슷한 거 같아요!
wqmgmi2Y,상위 15%,24.01.19,블루그레이,,생각보다 커요,보통이에요,화면과 비슷해요,157cm,43kg,상의 44,"퀄리티가 아주 좋다고는 못하겟는데
음.. 가격대비 나쁘지 않아요 ㅎㅂㅎ
색상이랑 핏도 무난무난하고 갠찮은 편이네요"
Rp3E8Ngw,,24.01.09,아이보리,,정사이즈예요,보통이에요,화면과 비슷해요,165cm,55kg,상의 55,베이지색 기본 이너니트가 필요했는데 샀어요 기존에 검은색있엇는데 가격대비 괜찮아서 재구매 했습니다 재구매는 항상 옳조 호
JmlrlhQa,,24.01.08,블랙,,정사이즈예요,아주 만족해요,화면과 비슷해요,155cm,55kg,상의 55,무난무난한 데일리 티셔츠입니당 어디에 입어도 잘 어울리고 추운날엔 니트나 맨투맨속에 이너로 입어도 좋습니다 소매가 길어서 여리여리하고 귀여워보야요
DO97ZoYd,상위 20%,23.12.13,라이트퍼플,,정사이즈예요,아주 만족해요,화면과 비슷해요,161cm,47kg,상의 44,"이쁜 라벤더 컬러예요~~ 
짱짱한데 생각보다 붙지 않고 낙낙해요 ! ! 
색별로 다 소장하고 싶은 니트입니다 ~~ 
추천해용"
kGsUgC09,,23.12.08,아이보리,,정사이즈예요,아주 만족해요,화면과 비슷해요,158cm,50kg,상의 55,"핏이나 색깔은 화면과 같고 예뻐요!
세탁해서 건조기 까지 돌리니 아주살짝 보풀이 일어나는것같네여
색깔 두가지 한번에 샀는데 같이 사길 잘한것 같아요"
Lf142U4g,,23.11.27,라이트퍼플,,생각보다 커요,보통이에요,화면과 비슷해요,168cm,62kg,상의 55,골지니트라 도톰할꺼라고 생각했는데 생각보다 얇은 골지네요. 두툼한 골지면 자칫 부해보일 수 있는데 얇아서 오히려 좋아요ㅎㅎ 컬러가 밝아서 맘에 듭니당!
6dz6g6sk,,23.11.21,블루그레이,,정사이즈예요,보통이에요,화면과 비슷해요,200cm 이상,30kg 이하,상의 33 이하,색이 오묘하고 이쁘네요! 쿨톤에게 잘 받을 것 같아요. 너무 두껍지 않으면서도 적당히 따뜻해서 이너로 잘 입을 수 있을 것 같아요!
amy4***,상위 25%,23.11.20,아이보리,,정사이즈예요,보통이에요,화면보다 어두워요,158cm,49kg,상의 55,생각보다 칙칙한 아이보리인데 그냥 무난하게 입을 수있을거같아요 한겨울에 이너로 입기늠 조금 얇긴한데 만족합니당!
qlcs*****,,23.11.18,블랙,,정사이즈예요,보통이에요,화면과 비슷해요,160cm,55kg,상의 55,"생각보다 낙낙하니 사이즈 맘에 들어요.
아직 1번밖에 안입어봤지만 목이 늘어나거나 보풀이 생기진 않았어요. 좋습니다"
5fPP3A9u,,23.11.14,아이보리,,정사이즈예요,아주 만족해요,화면과 비슷해요,,,,"골지니트 필요해서 여러쇼핑몰 보다가 여기서 구매했어요 
상품받아보니까 여기서 구매하길 너무 잘한거있죠…보통 이런옷은 한철입고 마는데 그 이상으로 입을수있을만큼 질이 좋아요"
5fPP3A9u,,23.11.14,블랙,,정사이즈예요,아주 만족해요,화면과 비슷해요,,,,"골지니트 필요해서 여러쇼핑몰 보다가 여기서 구매했어요 
상품받아보니까 여기서 구매하길 너무 잘한거있죠…보통 이런옷은 한철입고 마는데 그 이상으로 입을수있을만큼 질이 좋아요"
GSP03rAI,상위 15%,23.11.13,블랙,,생각보다 커요,보통이에요,화면과 비슷해요,163cm,54kg,상의 66,생각보다 넉넉해서 편안하게 입어져요. 한겨울에는 추울거 같은 두께이지만 만족합니다. 길이도 적당해서 넣어입기 좋아요~
DWPKr04r,,23.11.09,블루그레이,,정사이즈예요,아주 만족해요,화면과 비슷해요,155cm,42kg,상의 44,저번에 블랙 사서 잘 입고 있는데 엄마가 편하다해서 이번엔 다른 컬러로 재구매했어요 골지인데도 안 부해보이고 좋아요 !
amy4***,상위 25%,23.11.05,블루그레이,,정사이즈예요,보통이에요,화면보다 어두워요,158cm,49kg,상의 55,블루그레이 아니고 그레이에 가깝고 화면이랑 아예 느낌이 다른 색입니당 어정쩡.. 차라리 그레이이거나 블루인게 나을듯 디자인이나 재질은 나쁘지 않아여 사실거면 다른색 사세요!
EAawLiEU,,23.10.30,블랙,,정사이즈예요,아주 만족해요,화면과 비슷해요,200cm 이상,130kg 이상,상의 99 이상,완전 기본템의 정석이에요! 어느 아우터 안에 받혀입어도 다 잘어울리는 스타일이고 검정색이라 덜 내복같아서 좋아요ㅎㅎ
bT9KojWl,,23.10.28,블랙,,정사이즈예요,아주 만족해요,화면과 비슷해요,152cm,40kg,상의 44,하늘색? 사서 입고 있었는데 무난무난하게 좋아서 검정색도 샀어요! 활용도가 높을 것 같고 여기저기 다 잘 어울릴거같습니당
LwGW917l,,23.10.20,라이트퍼플,,정사이즈예요,아주 만족해요,화면과 비슷해요,169cm,59kg,상의 55,어깨선 딱 떨어지게 나온 핏이고 55기준 여유있게 맞아요 그렇다고 너무 펑퍼짐하지도 않고요 팔이 긴 편인데 소매도 그리 짧지 않네오
XtNz0HsP,,23.10.16,라이트퍼플,,생각보다 커요,보통이에요,화면보다 밝아요,160cm,50kg,상의 55,"여름뮤트에 어울리는 라벤더색입니다
이렇게 붙는 티는 다소 부담스러워 잘 안 입었는데 막상 착용해보니 괜찮네요
전에 블루그레이 샀다가 괜찮길래 산거임"
한나나나나나나나,,23.09.28,아이보리,,정사이즈예요,보통이에요,화면과 비슷해요,158cm,53kg,상의 55,딱 보이는 그대로고 생각보단 골지의 디테일이 잘 되어 있어서 놀랐고 껴 입기에 괜찮은 얇은 이너로 매일 입을 것 같습니다용
JWMTVdru,상위 15%,23.07.05,아이보리,,정사이즈예요,보통이에요,화면과 비슷해요,165cm,55kg,상의 55,완전 맘에 들어요 소라색이 넘 맘에 들어서 또 구매했어요 아이보리보다 소라색이 더 맘에 들긴 해요 데일리로 입기 좋아요 ⭐️⭐️
jIB1P9AE,,23.05.29,라이트퍼플,,정사이즈예요,아주 만족해요,화면과 비슷해요,156cm,44kg,상의 44,기장이랑 퀄리티 좋아요 입었을 때 딱 적당하게 떨어지는 기장입니다! 색은 화면이랑 같긴한데 제가 입으니까 살짝 할머니 느낌도 나요ㅋ̆̈ㅋ̆̎ㅋ꙼̈ㅋ꙼̎ 그래도 잘 입고 다닙니다~
JZK5253N,,23.05.18,블루그레이,,정사이즈예요,아주 만족해요,화면과 비슷해요,158cm,49kg,상의 55,"처음에 퍼플 사고 너무 마음에 들어서 블루, 블랙 추가구매했어요 기본으로 입기도 예쁘고 바지든 치마든 매치하기 좋아요"
JZK5253N,,23.05.18,블랙,,정사이즈예요,아주 만족해요,화면과 비슷해요,158cm,49kg,상의 55,"처음에 퍼플 사고 너무 마음에 들어서 블루, 블랙 추가구매했어요 기본으로 입기도 예쁘고 바지든 치마든 매치하기 좋아요"
hjeong27,,23.05.17,라이트퍼플,,정사이즈예요,아주 만족해요,화면과 비슷해요,166cm,69kg,상의 77,일단 색이 예뻐요. 그리고 핏도 나쁘지는 않아서 괜찮았지만 도톰한 느낌이 있어 요즘에는 입기 어렵네요. 날씨가 선선한 가을에 입어야겠어요.
wRFQlpEk,,23.05.15,블랙,,정사이즈예요,보통이에요,화면과 비슷해요,,,,몸에 여유있게 맞아서 부담스럽지 않아서 좋아요 목파임도 없는데 답답하지는 않고 예뻐요 길이오 적당해서 넣어 입었을 때 편해요
wOMqky7t,,23.05.04,블루그레이,,정사이즈예요,보통이에요,화면과 비슷해요,160cm,50kg,상의 55,생각보다 색이 너무 예뻐요 애매한 색이라고 생각햇는데 전혀 아니에요 ㅎㅎ 길이감 핏 넥라인 다 괜찮습니다 고민말고 구매하세요
GGjJIuZc,,23.05.02,블루그레이,,정사이즈예요,보통이에요,화면과 비슷해요,,,,"목쪽이 좀 많이 파인듯한 느낌이에요.
상체에 살집이있으신분들은 좀 부하게 느껴지실듯 한 컬러네요.
이너로 입긴 좋을것 같아요"
lhQvF1Hk,,23.05.01,블랙,,정사이즈예요,아주 만족해요,화면과 비슷해요,169cm,55kg,상의 55,"기본으로 자켓 안에 입어도 되고 단독으로 입기 좋아요.
정핏으로 깔끔해서 좋아요 ~ 까끌거리지 않아서 이너 없이도 괜찮아요."
lQvLWgGk,,23.04.26,블루그레이,,작아요,보통이에요,화면과 비슷해요,,,,옷의 퀄리티는 괜찮은데 생각했던 것보다 더 핏한 느낌이라 입었을 때 좀 부어보여요. 옷 안에 받쳐 입으면 좋을 것 같아요.
8sVASU6c,,23.04.22,블랙,,생각보다 커요,보통이에요,화면과 비슷해요,164cm,51kg,상의 55,"생각보다 루즈?해서 좀 아쉬워요.
핏 되면 더 예쁠 것 같아 샀는데 ㅠㅠ
골지라 여기저기 매치해도 예뻐요~
블랙은 좀 재질이 다름 컬러보다 덜 부드러워요"
sJtuTqtp,,23.04.20,아이보리,,정사이즈예요,보통이에요,화면과 비슷해요,158cm,41kg,상의 44,아주 보들보들하고 좋아요 소매도 짧지않고 긴편이라 좋고 편하게 잘 입고다닐 수 있을 것 같아요 벌써 두번입었네요 데일리템
jSbdheRT,상위 10%,23.04.20,블루그레이,,정사이즈예요,아주 만족해요,화면과 비슷해요,163cm,50kg,상의 55,같은 상품 아이보리색 사서 잘 입다가 다른 색도 구매했어요! 얇은니트인데도 튼튼함이 느껴지고 색이 정말 예쁘네요 비침도 없고 날씬해 보여요☺️
