아이디,리뷰어 등급,작성 날짜,옵션1,옵션2,상품 사이즈,퀄리티,색감,키,몸무게,사이즈,리뷰내용
JGAZlTx4,,24.10.05,아이보리,FREE,정사이즈예요,아주 만족해요,화면과 비슷해요,160cm,49kg,상의 44,색도 딱 원하던 색이고 도톰하고 따뜻하고 부드러워서 너무 마음에 들어요!!!! 다른색깔도 구매하려구용 잘 입을게요
뚱땅똥땅뿡땅뽕,상위 1%,24.09.28,네이비,FREE,정사이즈예요,보통이에요,화면과 비슷해요,160cm,46kg,상의 55,"저한텐 목이 너무 졸려보여요
보푸라기 잘일어나게 생겼어요 ㅠ 
대신 촉감은 좋구 맨살에도 까슬이지 않아요
겨울에 잘입을것같네영"
g3nl1p4J,상위 30%,24.09.12,아이보리,FREE,정사이즈예요,아주 만족해요,화면과 비슷해요,155cm,44kg,상의 44,생각보다 더 탄탄한 재질의 니트입니다 포근하고 디자인도 귀엽고 여기저기 잘 어울릴 것 같아서 올 겨울 잘 입을 수 있을듯해요
wldu*****,상위 5%,24.05.01,아이보리,FREE,정사이즈예요,보통이에요,화면과 비슷해요,165cm,50kg,상의 55,둘러보다 세일하길래 샀는데 조은거가타용 ㅎㅎㅎㅎ 두껍고 탄탄하고 다가올 겨울에 입기조은 니트입니당~!! 네이비색도 샀어용
wldu*****,상위 5%,24.05.01,네이비,FREE,정사이즈예요,보통이에요,화면과 비슷해요,165cm,50kg,상의 55,네이비색이랑 아이보리랑 세일하길래 다른거 주문하면서 사봤는데 소재도 탄탄하고 두꺼워서 겨울에 입기 조은 니트 같습니당
minj******,,24.04.27,네이비,FREE,정사이즈예요,아주 만족해요,화면과 비슷해요,160cm,50kg,상의 44,"전체적으로 질이 좋아요 옷도 두툼하고 짜임도 예쁘고 색감도 깔끔합니다
지금은 못 입겠지만 날 다시 추워지면 자주 손이 갈것같아요"
HhMOQodR,,24.04.24,아이보리,FREE,정사이즈예요,보통이에요,화면과 비슷해요,159cm,44kg,상의 44,"세일하길래 겨율에 입으려고 저렴하게 구매했어요 ! 
부들부들하고 폭닥한 느낌이여서 마음에 듭니닽 
다른색듀 구매할까봐요 ~"
8rNTUMZ5,,24.04.21,아이보리,FREE,정사이즈예요,아주 만족해요,화면과 비슷해요,158cm,48kg,상의 44,엄청 넉넉한 핏은 아닌데 아방하고 귀여운 니트입니다. 싸게 구매해서 좋네요. 입어보고 괜찮으면 네이비도 살려구요.
MBPpYZ2D,,24.03.31,네이비,FREE,정사이즈예요,아주 만족해요,화면과 비슷해요,164cm,50kg,상의 44,"퀄리티 가걱 대대대 만족.. 네이비도 샀는데 보들보들 너무 좋아요
슬렉스에 입으면 깔끔하고 청바지에 입어도 이뻐오 ㅎㅎ"
MqqIR8Jl,,24.03.25,아이보리,FREE,정사이즈예요,보통이에요,화면과 비슷해요,159cm,57kg,상의 55,한철 입기 좋은 니트! 보슬보슬 겉면이 풀어지고 보풀 올라오기 때문에 오래입진 못해요 그래도 이쁘고 길이 좋고 ~ 부드럽구요 ㅎㅎ
xt2mYtha,,24.03.17,아이보리,FREE,정사이즈예요,아주 만족해요,화면과 비슷해요,160cm,53kg,상의 55,진짜 너무너무너무 예쁘고 따뜻하고 폭닥해서 진짜 추천 …….. 귀여움까지 더해져서 추천합니다!!! 봄가을겨울 모두 입을 수 있을 것 같고 겨울에는 코트랑 같이 입으면 될 것 같아용
eaKxz3RF,,24.03.17,아이보리,FREE,정사이즈예요,아주 만족해요,화면과 비슷해요,158cm,58kg,상의 55,이 가격에 이렇게 퀄리티 좋은 니투 처음봐요.. 부드럽고 핏도 아방해서 편하게 입기 좋아요! 다른 색으로 더 사고싶어용 ㅎ
1aN7pWOk,,24.03.14,아이보리,FREE,정사이즈예요,보통이에요,화면과 비슷해요,153cm,47kg,상의 55,소재는 폭닥폭닥한 느낌이고 좀 부해보이는 느낌이 들긴 들어요 그래도 따뜻해서 요즘 입기에 좋습니다.! 보풀은 안날거같아요
M3r480xS,,24.03.12,네이비,FREE,정사이즈예요,아주 만족해요,화면과 비슷해요,153cm,45kg,상의 66,길이도 딱 적당해서 좋아요 부들부들하고 무겁지만 가벼운 ㅋㅋ완전 편합니다 사진이랑도 똑같고 잘산거같아요 꼭 사입으세여 ㅎㅎㅎ
TknelASM,,24.03.12,네이비,FREE,정사이즈예요,아주 만족해요,화면과 비슷해요,157cm,51kg,상의 55,"가성비 좋아서 만족하면서 입고있어용
색감도 예쁘규 핏도 좋아요
추천할만 합니당 요즘 추울때 입기도 좋고 괭차나용 구매하세요"
add5***,,24.03.09,아이보리,FREE,정사이즈예요,아주 만족해요,화면과 비슷해요,162cm,53kg,상의 55,도톰하고 부드럽고 퀄리티가 넘 조아요! 뒷판도 꽈배기였으면 더 이쁠거 같아요 ㅎㅎ 날씨 따뜻해질때까지 열심히 입고다녀야겠어요
xSQcldeT,,24.03.09,아이보리,FREE,정사이즈예요,아주 만족해요,화면과 비슷해요,165cm,43kg,상의 44,가격 대비 질이 너무 괜찮아서 놀랐어요!! 핏은 완전 정핏이고 목 부분이 살짝 답답하지만 단정해보여서 출근룩으로 적합합니다~.
oJwSSCsp,,24.03.09,아이보리,FREE,정사이즈예요,아주 만족해요,화면과 비슷해요,,,,보들보들하고 길이도 너무 크롭이 아니라서 마음에 들어요 🥹 색감도 예쁩니다 차콜도 사고싶은데 품절이라 넘 아쉽네용..
yxx2,상위 10%,24.03.06,네이비,FREE,정사이즈예요,아주 만족해요,화면과 비슷해요,165cm,55kg,상의 55,앞에 아이보리색상사고 자주손이가서 네이비색상도샀는데 너무너뮴 마음에들어요 배송도빠르고 깔별로쟁여둬야될까봐요 🩵
jskGJHMu,,24.03.05,아이보리,FREE,정사이즈예요,아주 만족해요,화면과 비슷해요,157cm,50kg,상의 44,"길이는 엉덩이 위에 까지구요
품이 넉넉합니다
두께가 있어서 따뜻하구요
까슬까슬하지 않아요
부들부들해서 느낌이 좋아요"
djVPFitN,,24.03.05,네이비,FREE,정사이즈예요,아주 만족해요,화면과 비슷해요,151cm,46kg,상의 55,진한 남색이고 핏도 예뻐요 꽤 두꺼워서 봄에는 아우터 없이 입어도 괜찮을듯 싶네요 사이즈는 정사이즈보다 살짝 큰 느낌 입니다
5lYYUr02,,24.03.03,아이보리,FREE,정사이즈예요,보통이에요,화면과 비슷해요,166cm,52kg,상의 55,"우선 색상이 너무 노란 느낌 없이 원했던 아이보리 정석이고, 소재가 생각보다 두툼하고 부드러워요
귀엽게 휘뚜루마뚜루 입기 좋아요~"
TSSFjuNy,상위 10%,24.03.03,아이보리,FREE,정사이즈예요,아주 만족해요,화면과 비슷해요,159cm,41kg,상의 44,"가격대비 품질이 너무 좋아요
무엇보다 부드러워서 맨살에 입어도 안따가운점이 제일 좋아요
폼은 오버핏도아니고 딱붙는핏도 아닌 핏이에요"
4HhkHSbZ,,24.03.02,아이보리,FREE,정사이즈예요,보통이에요,화면과 비슷해요,160cm,52kg,상의 55,"재질이 부드러워서 맨살에 입어도 괜찮아요.
예쁜 아이보리 컬러라 휘뚜루마뚜루 잘 입을수 있을것 같아요. 기장도 딱 적당하게 예뻐요."
VL6BPeMG,상위 20%,24.02.26,아이보리,FREE,정사이즈예요,아주 만족해요,화면과 비슷해요,,,,사진은 햇빛 받아서 하얗게 나왔는데 실제론 노란끼 돌아요 그점만 좀 아쉽고 기장감도 딱 좋고 부해보임도 적어서 좋습니다
eheh*****,,24.02.24,네이비,FREE,,,,,,,"와 진짜 인생 꽈배기 니트입니다 ㅠㅠㅠ
색깔도 원하던 네이비 색에 깔끔하고 적당히 도톰해서
봄에 혼자 입기도 좋을듯해용
넘만족"
KWlc1yyH,,24.02.23,아이보리,FREE,정사이즈예요,아주 만족해요,화면과 비슷해요,163cm,52kg,상의 55,"163 54
두꺼워서 추운 겨울에 입기 좋아요
따뜻하고 패턴도 색도 예뻐요
까슬거리지 않고 부드러워요
저렴해보이지 않아요"
GrwGWGCx,,24.02.23,아이보리,FREE,정사이즈예요,아주 만족해요,화면과 비슷해요,165cm,49kg,상의 44,니어웨어 제작 니트 다 예뻐요.. 재질도 좋고 촌스러운 꽈배기 모양도 아니라서 퀄리티도 좋아보여요! 두툼하고 따뜻해요
zPNli4Mr,,24.02.21,아이보리,FREE,정사이즈예요,보통이에요,화면과 비슷해요,160cm,51kg,상의 55,너무 부해보이지 않는 핏이라 좋아요 패턴이 참 예쁩니당 보풀은 잘 날 것 같은데 예쁘네용 ㅎㅎㅎ 배송도 빠른편이었어요!!
qHcMYIqc,상위 25%,24.02.21,아이보리,FREE,정사이즈예요,보통이에요,화면과 비슷해요,167cm,55kg,상의 55,촉감도 좋고 마음에 들어요 디자인도 이쁘구요 마음에 드네요 배송이빨라서 좋앗어요 색감도 이뻐서 다른색도 구매하고 싶내요
림찌,,24.02.21,핑크,FREE,정사이즈예요,아주 만족해요,화면과 비슷해요,160cm,45kg,상의 44,짜임도 예쁘고 보들보들해요 맨살에 닿아도 까슬거림없어서 좋았습니다 색감은 살짝 어두운 핑크에요 예쁩니당 길이감도 길지않고 적당해요
FdrZmlQ2,,24.02.19,아이보리,FREE,정사이즈예요,아주 만족해요,화면과 비슷해요,153cm,48kg,상의 44,컬러자체가 너무 몽글몽글 따뜻한 색감이라 휘뚜루 마뚜루 입기 좋아요 ! 봄에 청바지랑 같이 입으면 코디끝입니당 ㅎㅎㅎ
f4NmDKd9,,24.02.19,아이보리,FREE,정사이즈예요,보통이에요,화면과 비슷해요,164cm,58kg,상의 55,"전혀 부해보이지도 않고 정핏이라 좋아요 색감도 예쁜 아이보리에요!!
가격에 비해 퀄리티가 좋아서 완전 잘샀다고 생각됩니당"
Id7uOXHP,,24.02.18,아이보리,FREE,정사이즈예요,아주 만족해요,화면과 비슷해요,166cm,50kg,상의 55,"부들부들 촉감좋아요.
두께도 꽤 두툼해서 따뜻합니다. 
초봄까지 단품으로 가능할듯하네요
출근룩으로 툭툭 입고 잘 다니는중입니다"
EylbAOmY,,24.02.17,아이보리,FREE,생각보다 커요,아주 만족해요,화면과 비슷해요,153cm,41kg,상의 44,조금 노랑끼 돌지만 이쁜 아이보리색이예여 가격대비 잘 산것같아요~니트재질도 좋아용 배송 완전 빨라용!!많이 파세용ㅎㅎ
MoNpTqI8,,24.02.16,아이보리,FREE,정사이즈예요,보통이에요,화면과 비슷해요,150cm,45kg,상의 44,쫀쫀하고 탄탄한 느낌이에요! 도톰해서 따땃하게 입을 수 있습니당 품이 좀 낙낙하긴 한데 엄청 부해보이진 않는 것 같아요
lMhHXPKI,,24.02.16,네이비,FREE,정사이즈예요,보통이에요,화면과 비슷해요,154cm,48kg,상의 55,실제색상보단 좀 밝게 나왔는데 실제론 좀 더 다크한 네이비 색상이여서 마음에 들었어요 재질도 부드럽고 편하게 착용하기 좋아요
X9tIt7gp,상위 25%,24.02.16,아이보리,FREE,정사이즈예요,보통이에요,화면과 비슷해요,150cm,45kg,상의 44,보풀이 입다보면 날 것 같지만 그래도 적당한 세미오버핏에 색감도 버터크림같아 만족합니당!! 남은 겨울 이쁘게 입어볼게용
_1.53__,,24.02.15,네이비,FREE,정사이즈예요,아주 만족해요,화면과 비슷해요,153cm,43kg,상의 44,"꽈배기가 넘 이뻐요!
색깔도 적당히 어두운 네이비라 넘 맘에들고
한겨울에 입기 딱 좋은 두께에요! 
베이지 반바지에 넘 잘어울림"
jAbQV5jY,상위 25%,24.02.15,핑크,FREE,정사이즈예요,아주 만족해요,화면과 비슷해요,167cm,52kg,상의 55,실제 색은 사진보다 더 진한데 색감이 너무너무 예뻐요 !! 니트 패턴도 예쁘고 촘촘하게 잘 짜져 있어서 만족하면서 입고 있습니다
cyZ7hLje,,24.02.14,핑크,FREE,정사이즈예요,아주 만족해요,화면과 비슷해요,158cm,51kg,상의 55,"색은 딱 딸기우유 색깔이예요!
생각보다 두툼한데 말랑한 느낌?이라 촉감도 좋아용
히트텍 안입어도 까슬거리지않아서 좋아요:)"
ttSs2tbV,,24.02.13,핑크,FREE,생각보다 커요,아주 만족해요,화면과 비슷해요,162cm,43kg,상의 44,"색 완전 이쁘고 배송도 빨라서 너무 좋아요!!
생각보다 도톰해서 따뜻해서 마음에 들어요!
앞으로도 잘 입고다닐 것 같아요♡♡"
yg70cADe,,24.02.13,네이비,FREE,정사이즈예요,아주 만족해요,화면과 비슷해요,151cm,44kg,상의 44,배송이 빨라서 좋네요 가격대비 품질이 좋습니다 ㅎㅎ 쿨톤에게 적극 추천합니다 포근하고 부드러운 느낌입니다 ~^^ ㅎㅎ
3FqxuRbA,,24.02.13,아이보리,FREE,정사이즈예요,아주 만족해요,화면과 비슷해요,158cm,49kg,상의 44,원하던 스타일이에요. 많이 따가울가봐 걱정했는데 생각보다 부드러워서 입기 편하고 밝은 아이보리라 얼굴이 환해보여서 마음에 들어요~
71j5yFSW,,24.02.13,아이보리,FREE,정사이즈예요,아주 만족해요,화면과 비슷해요,168cm,58kg,상의 55,색감이 나와있는 그대롭니다.. 너무 예쁘고 질 정말 좋아서 자주 입을 것 같아요~!! 가격도 괜찮아서 아주 추천드립니당
qwdwNEMa,,24.02.12,아이보리,FREE,정사이즈예요,아주 만족해요,화면과 비슷해요,160cm,52kg,상의 55,"니트 너어무 예뻐요
꽈배기라 부해보일까봐 걱정했는데
핏도예쁘고 폭닥폭닥하니 부드럽고 좋아요
다른색도 살예정입니다~"
아랑리뷰,상위 1%,24.02.12,아이보리,FREE,정사이즈예요,아주 만족해요,화면과 비슷해요,160cm,60kg,상의 55,단정하게 입기 좋아요 저한테는 어깨가 약간 애매해서 조오금 덩치가 있어보이긴 해요 ㅜㅜ 그래도 색감도 예쁘고 만족해요 ㅎㅎ
1EChtCUb,,24.02.11,아이보리,FREE,정사이즈예요,아주 만족해요,화면과 비슷해요,165cm,52kg,상의 55,"예뻐서 다른 색으로 하나 더 샀어여ㅎㅎ 짱짱하고 패턴도 예쁘고 좋습니당. 가성비최고에요 다음 겨울에
다른 색으로 더 장만하고싶어요"
MrJnGEaU,,24.02.11,네이비,FREE,정사이즈예요,아주 만족해요,화면과 비슷해요,158cm,48kg,상의 55,따뜻하고 목이 쫀쫀해서 안늘어날거 같고 좋아요 그렇다고 목이 막 조이는건 아니고 적당히 포근해요 재질도 톡톡하니 부드럽고 좋아요
Lom0K1qc,,24.02.09,네이비,FREE,정사이즈예요,아주 만족해요,화면과 비슷해요,165cm,50kg,상의 55,적당히 두꺼워서 한겨울에도 입을 수 있습니다. 러나 부해보이지는 않고 핏이나 길이가 적당해서 예쁩니다. 색깔별로 추천합니다.
Lom0K1qc,,24.02.09,아이보리,FREE,정사이즈예요,아주 만족해요,화면과 비슷해요,165cm,50kg,상의 55,적당히 두꺼워서 한겨울에도 입을 수 있습니다. 러나 부해보이지는 않고 핏이나 길이가 적당해서 예쁩니다. 색깔별로 추천합니다.
AlTz0Lne,,24.02.09,아이보리,FREE,정사이즈예요,보통이에요,화면과 비슷해요,,,,생각보다 노란빛이 돌아서 반품할지 입을지 고민하다가 폭닥한 느낌이 좋아서 그냥 입으려구요. 부드럽고 두께감도 있어서 따뜻해요
tzZurQca,상위 15%,24.02.07,아이보리,FREE,정사이즈예요,아주 만족해요,화면과 비슷해요,168cm,60kg,상의 55,도톰하고 너무 이뻐요 ! 그냥 니트가 니트지라고 생각했는데 어디에 매치해도 괜찮고 뭔가 포근한 느낌이라 더 맘에들어요 ㅎㅎ
pjwOtncU,상위 25%,24.02.07,아이보리,FREE,정사이즈예요,아주 만족해요,화면과 비슷해요,156cm,52kg,상의 66,화면과 색감 그대로고 재질도 보들보들해서 너무 마음에듭니다!! 약간 박시한? 핏이 있어서 편하게 입을수 있을것 같아요~
n6q9QZzn,,24.02.07,네이비,FREE,정사이즈예요,아주 만족해요,화면과 비슷해요,,,,니트 꽈배기 너무 예뻐요!! 네이비 색상도 무난하고 핏도 맘에 들어요! 니트가 두툼해서 겨울에 따뜻하게 잘 입을 것 같아요!
seon*****,,24.02.06,핑크,FREE,정사이즈예요,보통이에요,화면보다 어두워요,168cm,63kg,상의 66,"생각보다 웜한 핑크에용 브라운핑크 느낌이라고 해야하나..
원하던 색상은 아니어서 좀 아숩긴 한데 패턴이 너무 귀엽네용ㅎ"
x6j24TVz,,24.02.06,네이비,FREE,정사이즈예요,아주 만족해요,화면과 비슷해요,,,,"생각보다 더 따듯하고 핏도 넉넉해서 좋았어요! 
색상도 화면에서 본것과 같아요.
다른 색으로 재구매 의사 있습니당👍"
dOfx0SjL,,24.02.06,아이보리,FREE,정사이즈예요,보통이에요,화면과 비슷해요,,,,진짜 컬러도 이쁘고 기장도 괜찮고 퀄도 좋습니다!!! 웜톤 쿨톤 할 것없이 모두에게 잘 어울려서 모두다 사세오
V2ZlxQv0,,24.02.06,네이비,FREE,정사이즈예요,아주 만족해요,화면과 비슷해요,172cm,52kg,상의 55,"남색 사길 잘했어용 여기저기 휘뚜루마뚜루 입기 좋아용
핏도 살짝 정사이즈-아방한 느낌이라서 적당히 바지나 치마랑 입기 좋아요"
LrHdyq4t,,24.02.05,핑크,FREE,정사이즈예요,아주 만족해요,화면과 비슷해요,160cm,67kg,상의 77,배송이 빨라서 좋아요~~ 색깔은 딸기우유색 같아요 진짜 예뻐요 마음에 들어요 그리고 생각보다 짱짱해서 니트가 좋네용 굿굿
LrHdyq4t,,24.02.05,아이보리,FREE,정사이즈예요,아주 만족해요,화면과 비슷해요,160cm,67kg,상의 77,배송이 빨라서 좋아요~~ 색깔도 상세페이지 그대로 아이보리 색으로 예뻐요 그리고 생각보다 짱짱해서 니트가 좋네용 굿굿
16vgozR8,,24.02.05,핑크,FREE,정사이즈예요,보통이에요,화면과 비슷해요,170cm,55kg,상의 66,"촉감이 엄청 부드럽고 소매가 길어서 좋네요
색감은 채도가 낮으면서도 형광등 켜주는 색깔이에요
핑크색 추천합니다~~"
wHVjes8p,,24.02.05,블랙,FREE,정사이즈예요,보통이에요,화면과 비슷해요,165cm,51kg,상의 55,보풀이 잘 일어날거같긴한데 기장이며 재질이며 딱 맘에 듭니다. 실밥정리가 안되어있어서 아쉽긴해요. 정전기가 대박입니다 ㅎㅎ
0v2wNTHs,,24.02.05,아이보리,FREE,정사이즈예요,아주 만족해요,화면과 비슷해요,164cm,52kg,상의 55,색깔과 디자인이 넘 맘에 들어서 구매했어요! 사진 그대로이고 단정해보여서 좋아요! 퀄리티도 가격에 비해 괜찮은 것 같아요
8xRCiiCN,,24.02.04,아이보리,FREE,정사이즈예요,보통이에요,화면과 비슷해요,,,,"배송이 조금 느리긴 했는데 옷은 마음에 들어요.
촉감도 부드러워서 이너 안 입어도 되고 도톰해서 하나만 입어도 안 추울 거 같아요."
h0LMsvOL,,24.02.04,아이보리,FREE,정사이즈예요,아주 만족해요,화면과 비슷해요,,,,퀄리티 좋고 괜히 유명한게 아닌 것 같다는 생각이 들어요! 부해보이지 않고 색감도 화면 그대로고 얼굴이 밝아보여서 맘에 들어요
gxOoqxF9,상위 15%,24.02.02,네이비,FREE,작아요,보통이에요,화면과 비슷해요,168cm,68kg,상의 55,길이는 적당했고 색은 화면에 있는 사진이랑 거의 비슷해요 착용감은 생각보다 따갑지 않고 그냥 맨몸에 입어도 괜찮았어요
Y8XRkSLY,상위 30%,24.02.02,핑크,FREE,정사이즈예요,아주 만족해요,화면과 비슷해요,163cm,54kg,상의 55,"사진은 베이지색 가깝게 나왔지만 이쁜 인디핑크고
짜임도 이뻐서 데일리로 입고 있어요
치마 청바지 슬렉스 어디에나 어울려요"
3Fhvthb1,,24.02.01,네이비,FREE,정사이즈예요,보통이에요,화면과 비슷해요,160cm,56kg,상의 55,"짜임이 예쁘긴 한데 마감이 좀 아쉬웠고 목이 너무 짱짱해서 답답해요.... 
근데 엄청 두꺼워서 따뜻해요 안 추워서 좋긴 해요"
YTXxAvUX,,24.02.01,네이비,FREE,생각보다 커요,아주 만족해요,화면과 비슷해요,156cm,37kg,상의 33 이하,굿굿 너무 예뻐용 재질도 가격대비 짱이고 색도 맘에 들어요 기장도 너무 길지않고 적당해요 근데 정전기가 조금 심한 편 ㅠㅠ
lMhHXPKI,,24.01.31,아이보리,FREE,정사이즈예요,아주 만족해요,화면과 비슷해요,154cm,48kg,상의 55,"예쁜 아이보리색이여서 마음에 들어요~~~
부드럽고 디자인도 예쁘고 무난하게 코디하여
입기 좋아요 다른 색도 구매해봐야겠어요"
soso****,상위 15%,24.01.31,차콜,FREE,정사이즈예요,보통이에요,화면과 비슷해요,162cm,43kg,상의 44,부들부들 두껍고 재질 톡톡해서 맘에 들어요 !! 보풀 생길 것 같긴 한데 색상도 맘에 들고 잘 입을 것 같습니당~ !!!!ㅜ
3Tp1jNie,,24.01.30,아이보리,FREE,정사이즈예요,아주 만족해요,화면과 비슷해요,156cm,53kg,상의 55,노란끼 낭낭한 아이보리 컬러에요!! 꽈배기 모양이라 너무 귀여워요 ㅜㅜㅜ 핏도 아방하게 잡하고 부드러운 소재라 좋습니당
9s4rH23a,,24.01.28,아이보리,FREE,정사이즈예요,아주 만족해요,화면과 비슷해요,160cm,50kg,상의 55,도톰하고 색도 이쁘고 짱이에요 진짜 다들 빨리 사세요 최근 산 니트중에 젤 만족 웜톤한테 짱 잘어울이는 색입니단 고민하지 마세용
qdpFK9cJ,상위 20%,24.01.27,아이보리,FREE,정사이즈예요,보통이에요,화면과 비슷해요,,,,색감이나 짜임이 너무 예뻐요~ 소매길이가 딱맞아요~ 혹시 짧아지면 안될것 같아서 세탁을 잘해야 겠어요~ 잘입을께요!!
ppjnhrN8,상위 30%,24.01.27,네이비,FREE,정사이즈예요,아주 만족해요,화면과 비슷해요,159cm,50kg,상의 44,도톰하고 편하고 이쁜게 ㄹㅇ 맛도리네요.. 이번애 네이비 구매했믄데 다음에 다른색도 구매해보려고요!! 짱이쁘고 맘에들어요
AFBsIzb0,,24.01.26,네이비,FREE,정사이즈예요,아주 만족해요,화면과 비슷해요,161cm,54kg,상의 55,"두껍고 좋아요. 색도 화면에 보이는거랑 똑같아요.
소매에 털이 살짝 올라오는데 뽑으면 괜찮아요👍
하얀색도 사려구용"
z6TgEF7S,,24.01.26,아이보리,FREE,정사이즈예요,아주 만족해요,화면과 비슷해요,153cm,43kg,상의 44,색이 예쁘고 도톰해서 겨울내내 따뜻하게 잘 입을것 같아요 까슬거리지 않고 부드러워요 그런데 보풀은 조금 일어날것 같아요
shj0****,상위 15%,24.01.25,아이보리,FREE,정사이즈예요,아주 만족해요,화면과 비슷해요,160cm,67kg,상의 66,아주 부드럽고 입었을 때 까끌거리는 느낌이 없어서 좋았어요! 디자인이 정말 예쁘고 사이즈도 정말 정사이즈여서 좋아요
Danni,,24.01.24,아이보리,FREE,정사이즈예요,보통이에요,화면과 비슷해요,160cm,50kg,상의 55,"꽈배기니트 갖고싶어서 찾다가 구매했어용
생각보다 너무 정사이즈인게 아쉽 ㅠㅠ
더 오버핏이면 예쁠 거 같아요
퀄리티는 만족합미다!"
y0kkk1p7,상위 25%,24.01.23,차콜,FREE,정사이즈예요,보통이에요,화면과 비슷해요,159cm,45kg,상의 55,맘에들어요. 직진배송 치고는 늦게 옴. 기장이 좀 긴 느낌이듬 나한테는. 그치만 옷 자체는 두꺼워서 겨울에 입으면 따수울거같음
WwDMJJ2y,,24.01.22,차콜,FREE,정사이즈예요,아주 만족해요,화면보다 밝아요,163cm,55kg,상의 55,"도톰하고 부드럽고 안에 검은티입어도 털빠짐이
별로 없네요 예쁩니다 후기가 좋아서 기대했는데 너무 만족입니다. 다른색도 사고싶어요"
eiyMhvfj,,24.01.22,네이비,FREE,정사이즈예요,보통이에요,화면과 비슷해요,162cm,57kg,상의 55,흰색 사고 네이비도 추가 구매 했어요 ㅎㅎㅎ 튼튼하고 예뻐요! 가성비 최고입니다! 배송도 빠르니 바로 입을 수 있었네용
57fUtATm,,24.01.22,차콜,FREE,정사이즈예요,보통이에요,화면과 비슷해요,160cm,55kg,상의 55,보들보들하고 예뻐용! 핏도 너무 크지도 작지도 않게 딱 떨어져서 아무데나 입기 좋습니당 !! 마음에 들어용 색상도 화면 그대로입니당
qNTQhsyD,상위 15%,24.01.21,네이비,FREE,정사이즈예요,보통이에요,화면과 비슷해요,,,,"색깔 완전 이쁘고 재질도 부드럽고 착용감이 편하고 좋아요 
그리고 두께도 생각보다 있어서 
따뜻합니다
자주 입게 될거같아요"
lJ1m8FYl,,24.01.20,아이보리,FREE,정사이즈예요,보통이에요,화면과 비슷해요,171cm,54kg,상의 55,팔이 좀 더 길고 넉넉했으면 좋겠지만 디자인은 예쁩니다! 색도 훨씬 더 누런 크림색이네요 배송은 오래걸렸지만 기다린 값하네여
tIzgPP65,,24.01.20,네이비,FREE,정사이즈예요,아주 만족해요,화면과 비슷해요,161cm,60kg,상의 66,"색감은 화면이랑 같아요! 무난해서 청바지, 조거팬츠 아무데나 입어도 좋아요!! 두꺼워서 따뜻해요!! 길이도 적당해요!"
EGZxuG8N,,24.01.20,아이보리,FREE,,,,,,,니트 짜임은 굉장히 마음에 들어요 근데 입으면 뭔가 부해보이는 느낌? 보풀도 많이 일어나요 한철입기 좋을듯? 합니다!!!
T1joL21n,상위 25%,24.01.19,아이보리,FREE,정사이즈예요,보통이에요,화면과 비슷해요,160cm,50kg,상의 55,가성비 최고에요 컬러별로 쟁여 놓을 까도 고민 중입니다 겨울에 입기 너무 좋고 따뜻해요 퀄리티도 미쳤어요 다들 구매 하세요
