아이디,리뷰어 등급,작성 날짜,옵션1,옵션2,상품 사이즈,퀄리티,색감,키,몸무게,사이즈,리뷰내용
laB11cxW,,23.12.26,Gray(그레이/기모),,정사이즈예요,보통이에요,화면과 비슷해요,162cm,53kg,상의 55,"엄청 따뜻해요,, 그래고 너무 편하고 지퍼도 부드러워서 휘뚜루마뚜루 입기 좋아요!! 기장도 너무 길지도, 크롭도 아닌 적당한 기장감입니당!!"
jQJIdURx,,23.11.27,Charcoal(차콜/기모),FREE,정사이즈예요,아주 만족해요,화면과 비슷해요,159cm,45kg,상의 44,핏 너무너무 예뻐요 모자가 커서 좋고 사이즈도 이쁘게 큼지막해용 지퍼도 두개라 답답하지도 않고 꾸안꾸로 딱 입기 좋은 후드집업입니당
ZsoA2Sp2,상위 25%,23.10.28,Black(블랙/쭈리),FREE,정사이즈예요,아주 만족해요,화면과 비슷해요,161cm,56kg,상의 44,"161 기준 엉덩이 위선에서 끝나는 기장이구요, 핏이 너무너무 이쁘네요 ! 모자도 너무 무겁지 않아서 목졸리는 핏도 안나오고 맘에 들어뇨"
s2vacLrk,상위 5%,23.10.07,Gray(그레이/기모),FREE,정사이즈예요,보통이에요,화면과 비슷해요,165cm,53kg,상의 55,급하게 필요해서 직진배송으로 빠르게 새벽에 받아볼수있어서 너무 좋네요 길이도 너무 짧지도 길지않아서 딱좋고 손목부분도 디자인 귀엽고 편하게 잘입을것같아요
buWk39wK,,23.09.12,Ivory(아이보리/쭈리),FREE,정사이즈예요,보통이에요,화면과 비슷해요,153cm,43kg,상의 44,색도 맘에 들고 포근해요ㅛ… 제 기준 엉덩이 살짝 덮는 기장이라 매우 좋습니다👍🏻 다만 지퍼가 좀 뻑뻑해요 못 올릴 수준까진 아니라 간절기용으로 잘 입고 다닐 것 같아요🫶🏻
2ZAvINQ8,,23.05.09,Black(블랙/쭈리),FREE,정사이즈예요,보통이에요,화면과 비슷해요,160cm,60kg,상의 77,간절기에 입기 딱 좋은 두께에요! 색상 깔끔하고 좋고요. 팔길이가 꽤 길고요! 품이 넉넉해서 미처 못 뺀 살 가리기에 최고입니당!!👍
2ZAvINQ8,,23.05.09,White melange(백멜란지/쭈리),FREE,정사이즈예요,보통이에요,화면과 비슷해요,160cm,60kg,상의 77,간절기에 입기 딱 좋은 두께에요! 색상 깔끔하고 좋고요. 팔길이가 꽤 길고요! 품이 넉넉해서 미처 못 뺀 살 가리기에 최고입니당!!👍
HcKgtlfa,,23.04.17,Black(블랙/쭈리),,정사이즈예요,보통이에요,화면과 비슷해요,165cm,60kg,상의 66,스탠다드 핏 후드집업인 것 같아요. 질은 그냥저냥 괜찮은 편이고 투웨이라 힙하게 입을 수 있어서 좋네요. 데일리쥬 후드집업은 다 괜찮은 것 앝아요
socc******,,23.04.04,Gray(그레이/쭈리),,정사이즈예요,아주 만족해요,화면과 비슷해요,152cm,44kg,상의 66,"매우매우 만족합니다!!
길이랑 핏 모두 생각하던 그대로구 특히 팔 부분에 쭈리가 귀엽고 마음에 들어요 ㅎㅎ 안에 티 레이어드 해서 입으면 딱이에요!"
yz568Tp0,상위 15%,23.04.04,Gray(그레이/쭈리),,정사이즈예요,보통이에요,화면과 비슷해요,163cm,52kg,상의 44,기대했던 것보다 핏이 예뻐서 마음에 들었는데 줄 색상이 통일 되었으면 더 만족스러웠을 거 같네요 소매가 다른 후드 집업이랑 달라서 더 귀엽게 느껴져요
h3s2XCnD,,23.03.26,Red(레드/쭈리),FREE,정사이즈예요,보통이에요,화면과 비슷해요,165cm,65kg,상의 77,뭔가...가격에 비하면 퀄리티가 떨어지긴하지만 그래도 색감이 너무 예뻐서 그냥 입고다녀요 지퍼얘기많이들 하시던데 진짜 잘못끼우면 큰일나는데 익숙해져서 지금 많이 괜찮아졌어요
NbsncSQJ,,23.03.06,White melange(백멜란지/쭈리),FREE,정사이즈예요,보통이에요,화면과 비슷해요,158cm,51kg,상의 55,색도 예쁘고 기장도 괜찮아요 봄철에 아우터로 입거나 레이어드용으로 이쁠것 같습니다 근데 아쉬운게 안에 보풀? 털같은게 자꾸 빠져요ㅜㅜ
ICpi7wAO,,23.03.03,Gray(그레이/쭈리),,정사이즈예요,보통이에요,화면과 비슷해요,167cm,57kg,상의 55,"기모제품으로 구매할걸그랬어요 쭈리원단이라 입었을때 힘없이 몸에 감기는게 별로에여..,,
그래도 지퍼가 포인트되고 걍 무난하게 잘닙어질거같아요"
ntIblxhN,,23.03.01,Black(블랙/기모),,정사이즈예요,보통이에요,화면과 비슷해요,161cm,59kg,상의 66,"실물이 훨씬 예뻐요ㅠㅠ 그런데 지퍼는 좀 뻑뻑해요.. 
그래도 기장감 좋고 딱 생각했던대로 입니다 !! 
핏은 기모 있어서 아방한 느낌으로 너무 좋아요"
hNsOxWbw,,22.12.28,Black(블랙/기모),,정사이즈예요,보통이에요,화면과 비슷해요,164cm,51kg,상의 55,"기모버전 샀는데 너무 만족해요!!! 기장이 길지는 않아서 안에 레이어드 티 입고 아래쪽 지퍼 올리면 딱 맞습니당
다른 색도 사고 싶을 정도에요"
Keydmgke,,22.11.13,Gray(그레이/기모),,작아요,아주 만족해요,화면과 비슷해요,,,,"모자가 생각보다 커서 가장 좋았어요
기모가 들어있어서 안에 반팔 입어도 별로 안 추워요
다만 검은 옷 입으면 털이 다 묻어서 불편하고 기장이 생각보다 짧아서 아쉬웠어요"
ufKVu0Wa,,22.11.05,Gray(그레이/기모),FREE,생각보다 커요,보통이에요,화면과 비슷해요,158cm,40kg,상의 44,"기본 후드집업 필요해서 구매했는데 따뜻하고 괜찮은거 같아요 :) 
길이는 제 키에 조금 길었던거 같고 투웨이라 핏은 괜찮은거 같아요 번창하세요 !"
Bd5QD6oF,,22.10.23,Black(블랙/기모),FREE,정사이즈예요,아주 만족해요,화면과 비슷해요,150cm,45kg,상의 44,기모 있는 후드집업 갖고싶었는데 박시한 스타일 밖에 없어서 찾다가 요기꺼 샀는데 핏도 넘 예쁘고 사이즈 너무 찰떡이에용 그리고 엄청 따뜻함 !!
qhsf**,,22.09.13,Gray(그레이/쭈리),,생각보다 커요,아주 만족해요,화면과 비슷해요,155cm,52kg,상의 55,"일단 색감이 너무 맘에 들었습니다
투웨이 지퍼라 잠궜을때도 불편하지 않고 좋았어요
기모를 기다려ㅛ다 살지 고민했는데 사길 잘 한거같아용"
ZQebwlQP,상위 1%,22.05.15,White Me Lange (backmelange/churry),,정사이즈예요,보통이에요,화면과 비슷해요,161cm,62kg,상의 55,핏도 괜찮고 길이감이 허리까지 오는데 너무 제가 원하는 기장이라 마음에 들었어요! 지퍼도 뻑뻑해서 힘들다는 후기 있었는데 저는 심하게 뻑뻑하지는 않아서 잘 입을 것 같아여:)
73**,,22.04.14,Gray(그레이/쭈리),,정사이즈예요,보통이에요,화면과 비슷해요,171cm,66kg,상의 55,손이 자주 가는 기본템! 그래서 핏 이쁜게 중요한데 편한데다가 핏도 이쁘구 아래지퍼도 열려서 다양한 스타일 연출할 수 있어서 좋아요:)
E88vhEud,,22.04.06,Gray(그레이/쭈리),FREE,정사이즈예요,보통이에요,화면과 비슷해요,,,,요즘 크롭 기장의 후드집업만 나와서 좀 긴 거 찾다가 보게 됐는데 길이감도 적당해서 잘 입고 다닐 거 같아요. 사진은 살짝 노랗게 나왔는데 상세 컷이랑 더 비슷한 색입니다!
aJPB1cXD,,22.03.10,Gray(그레이/기모),,정사이즈예요,아주 만족해요,화면과 비슷해요,162cm,54kg,상의 55,"지퍼가 뻑뻑하긴 한데 괜찮아요 ~
기모로 사길 잘 한 것 같네요 ㅎ ㅎ 
기장 짧은건 예상했지만 생각보다 더 짱ㅂ네용 ,,
근데 예쁘고 퀄리티도 나쁘지 않아요 !!!"
TBVH6yY1,,22.03.09,Charcoal(차콜/기모),,정사이즈예요,보통이에요,화면과 비슷해요,165cm,53kg,상의 55,"실밥 같은게 좀 있긴하지만 퀄리트 좋은 편입니다 
샹각보다 연한 차콜이어서 저랑 잘 어울리는 색은 아니지만 핏이 예브고 기모가 있어서 따뜻해요 추운 밤에 입으면 좋을 것 같습니다 ~"
sXrgp9Su,,22.03.01,Gray(그레이/기모),,정사이즈예요,아주 만족해요,화면과 비슷해요,168cm,61kg,상의 55,너무 이뻐요 착용했을때 적당한 크롭기장이랑 색감이 이뻤어요ㅎㅎ 근데 지퍼 두개인데 밑에 부분이 조금 올리고 내리는게 힘들었어요🥲 핏감은 정말 이쁩니다. 데일리 꾸안꾸로 제격이에요
jtMhJGq5,,22.02.22,Gray(그레이/쭈리),,작아요,보통이에요,화면과 비슷해요,168cm,58kg,상의 55,어엄 제 몸이 문제겠지만 피팅샷보고 오버핏일줄알았는데 딱 정사이즈인 느낌이에요 길이도 딱 허리끝정도 까지고! 지퍼가 올리기힘들다는 느낌은 별로 못받았어요
yWRZFebc,,22.02.14,Gray(그레이/쭈리),,정사이즈예요,아주 만족해요,화면과 비슷해요,162cm,51kg,상의 55,"후기대로 지퍼가 뻑뻑함
근데 몇 번 입으면 익숙해져서 괜찮을 것 같음
핏은 약간 오버느낌이 들어서 안에 뭘 입어도 괜찮을 듯
가격에 비해 질은 좋은 느낌"
ELikEYjJ,,22.02.11,Black(블랙/쭈리),,정사이즈예요,아주 만족해요,화면과 비슷해요,165cm,71kg,상의 77,와 이거 꼭 사세요 진짜 생각보다 엄청 이뻐요 다만 안에 입은 티에 옷가루?? 같은게 좀 묻어 나오긴 했지만 그래도 엄청 만족합니다!! 핏도 엄청 예뻐요 봄 가을에 입어도 굿굿
xF2vb3V5,,21.12.24,Charcoal(차콜/기모),,정사이즈예요,보통이에요,화면과 비슷해요,165cm,50kg,상의 44,"색깔은 화면과 같고 길이는 생각보다 짧았습니다 ㅎ 그래도 핏도 예쁘고 기모도 엄청 부드러워서 예쁘네여 
배송 늦게 올 줄 알았는데 생각보다 일찍 와서 놀랐어요!"
Ulq28kpF,,21.12.20,Gray(그레이/기모),,정사이즈예요,보통이에요,화면과 비슷해요,165cm,60kg,상의 55,키가 165인게 짧다고 느껴지는 않습니다. 두번입었는데 소매에 보풀아닌 기모 찌꺼기가 계속나오는걸 보니 가격대비 좋다는 생각은 못하겠습니다 그래도 탄탄해서 잘입고다닐듯 합니다!
CGqcTekq,상위 20%,21.12.18,Charcoal(차콜/기모),,생각보다 커요,보통이에요,화면과 비슷해요,155cm,46kg,상의 55,사이즈는 제가 체구가 작은 편인데 되게 넉넉했어요 첨엔 너무 오버핏인가 싶었는데 입다보니 적당한 것 같아요 두께감도 있어서 요즘 날씨에 이너로 입기 딱 좋아요
dakd******,,21.11.28,Black(블랙/기모),,생각보다 커요,아주 만족해요,화면과 비슷해요,160cm,48kg,상의 44,"넉넉하니 모자가 커서 귀엽게 입기 좋아용
기장은 적당하구요 재질이나 마감 다 좋아요
먼지 붙은건 적당히 잘 떼면 되는데.. 찍기전에 귀찮았나봄.."
jWh9ICjo,,21.11.25,White melange(백멜란지/쭈리),,정사이즈예요,아주 만족해요,화면과 비슷해요,156cm,47kg,상의 55,가을에 운동갈 때 편하게 잘 입었습니다 엉덩이를 반 정도만 가려줘서 레깅스를 신으면 좀 길이가 애매하긴 했는데 그래도 이뻐서 괜찮았어요
obQVq5rq,,21.11.20,Gray(그레이/기모),,정사이즈예요,보통이에요,화면과 비슷해요,160cm,70kg,상의 88,"지퍼 잠구고 다시 풀 때 맨 아래쪽에서 걸려서
잘 안 빠지는데 그거 빼고는 다 좋아요
개따숩 핏 예쁜데 기여움 손목시보리 짱짱함
ටㅏ 주머니 안쪽도 기모 있어서 보들보들 짱 따숩"
b1e1gQaU,,21.11.07,Gray(그레이/기모),,정사이즈예요,보통이에요,화면과 비슷해요,159cm,45kg,상의 44,"질 좋고 따뜻하고 핏 예뻐요!
모자 흐물거리는거 딱 질색인데 크고 짱짱해서 더 마음에 들어요
다만 아래쪽 지퍼가 끝까지 잘 안내려가서 지퍼를 풀기 조금 힘들다는게 단점이에요"
rTMQoM5V,,21.11.06,Gray(그레이/기모),,정사이즈예요,보통이에요,화면과 비슷해요,159cm,48kg,상의 55,"두께감도 좋고 핏도 너무 좋아요
지퍼가 좀 뻑뻑하긴하지만 흐린눈하면 될 정도로
지금까지 산 후집중에 최고 퀄리티~~~ 깔별로 쟁일려구요"
mi**,,21.11.04,Gray(그레이/기모),,정사이즈예요,아주 만족해요,화면과 비슷해요,158cm,45kg,상의 44,지퍼가 약간 불량인지 휘어져있어 불편하긴한데..가격대비 좋네요! 기모도 따뜻하고 재질도 괜찮습니다. 요즘 후드집업들이 다 너무 길거나 크롭이거나했는데 길이감도 적당하고 핏도 예쁘네요
JFv2bPjP,,21.11.01,Gray(그레이/기모),,정사이즈예요,아주 만족해요,화면과 비슷해요,,,,후드 집업 성공적! 너무 길지도 않고 크롭처럼 너무 짧지도 않은 제가 딱 원하던 기장이라 너무 마음에 듭니다~ 소매도 귀엽고 전체적인 핏도 좋아요!
e_j1**,상위 30%,21.10.30,Gray(그레이/기모),,정사이즈예요,보통이에요,화면과 비슷해요,160cm,60kg,상의 55,"후기에 퀄리티 별로라는 말을 보고 감수해서 구매했는데 저는 괜찮았어요,, 핏이 존예 ;; 생지와이드에 야상입으면 세상 예쁠 수 없습니다,,"
Q2RMEhSl,상위 10%,24.11.19,Gray(그레이/기모),,정사이즈예요,보통이에요,화면과 비슷해요,161cm,50kg,상의 55,"디테일이 좋지는 않지만 그냥저냥 입을만한거같아 
교환환불도 귀찮고 ㅠ 
먼지가 어마무시해요 저런 실도 빠지고 먼지도 
많아서 재채기 바로나와요 ㅋㅋ"
4HaEv6sf,,24.10.09,Black(블랙/기모),,정사이즈예요,아주 만족해요,화면과 비슷해요,162cm,45kg,상의 44,이제 추워져서 하나 구매했는데 만족합니다 ㅎㅎ 이런 디자인 찾기 힘든데 좋아유 지퍼가 좀 뻑뻑하긴 하지만 매우 맘에듭니당
Ua0PYEfb,,22.01.26,Gray(그레이/기모),,정사이즈예요,보통이에요,화면과 비슷해요,162cm,60kg,상의 66,투웨이 지퍼 밑부분이 좀 뻑뻑하긴해요 ㅠㅠ 기모라서 포근하고 모자넘어가는 핏도 예뻐 만족합니다
d3**,,21.11.11,Gray(그레이/기모),,정사이즈예요,보통이에요,화면과 비슷해요,155cm,46kg,상의 44,"오자마자 흰티랑 레이어드해서 입었는데
넘 이뿐거 아닌가효 ㅠㅠ 제가 원하던 핏이여요,,
휘뚜루 마뚜루 제일 손이 많이 갈 옷 ❤️❤️❤️"
PNRYQB3o,,23.10.09,Gray(그레이/기모),FREE,정사이즈예요,보통이에요,화면과 비슷해요,156cm,44kg,상의 44,"생각보다 오버핏 아니고 세미오버핏 정도고
지퍼는 걱정했던거 보단 잘되요
옷은 이뻐요! 
직진배송이라 주문한날 바로 배송받아서 넘 좋아요"
2CvkuTtj,,23.03.24,Gray(그레이/쭈리),FREE,정사이즈예요,아주 만족해요,화면과 비슷해요,163cm,54kg,상의 55,지금 날씨에 입고다니기 딱 좋네여! 너무 덥지도 않고 춥지도 않아용! 색은 그레이정말 만족스럽습니당ㅎㅎ 가볍게 입고 다니기 정말 좋아용!
4uC79AuH,,23.02.28,Black(블랙/기모),FREE,정사이즈예요,아주 만족해요,화면과 비슷해요,159cm,40kg,상의 44,"요즈음 패딩 입기는 덥고,, 아침 저녁은 쌀쌀한데 요럴때 딸아이 입기 딱이네요. 너무 두텁지 않고 적당한 기모에 여유있는 품이라 넉넉하고 길이는 길지 않아요."
fz6IiIJp,,23.02.24,Charcoal(차콜/기모),FREE,생각보다 커요,보통이에요,화면과 비슷해요,169cm,58kg,상의 66,살짝 아쉬웠던건 이 가격에는 조금 못미치는 퀄리티였어요ㅠㅜ 모양하고 색감이 너무 이뻐서 잘 입고 다닙니다! 조금만 더 싸지면 여러개 쟁여둘꺼 같아요
hIapAmqR,,22.12.04,Navy(네이비/쭈리),,정사이즈예요,아주 만족해요,화면과 비슷해요,153cm,47kg,상의 55,편하게 입고 다니기 좋아요! 양방향으로 지퍼를 여닿을 수 있어서 앉았을 때 걸리적 거림이 없어서 편해요~~ 앞으로 자주 입고 다닐 것 같아요ㅎㅎ 길이도 너무 길지도 않고 딱 예쁜 길이고 손목 밴딩이 있어서 흘러내리지 않고 핏도 예뻐요!
kA6sWPWG,,22.11.18,Charcoal(차콜/기모),FREE,정사이즈예요,아주 만족해요,화면과 비슷해요,159cm,50kg,상의 44,맨날 크롭 아니면 개오버핏이라 후드집업 못사고 있었는데 띠용? 이겁니다 159 기준 딱 정 핏입니다. 제가 너무너무 원하던!팔목 시보리도 짱짱하고요? 정핏이면 허리 시보리 쫄리는 곳도 많은데 이건 제가 딱 원하던 허리 널널한 핏 ㅠㅠ걍 예쁨 ㅠㅠ 배송도 하루만에 왔어요 다른색도 어서 사야겠다 최고임
olim,상위 10%,22.10.31,Black(블랙/기모),FREE,정사이즈예요,보통이에요,화면과 비슷해요,168cm,50kg,상의 55,"기모 진짜 따수워요 꽤 도톰하게 들어있고 길이나 핏 전부 다 마음에 들었는데 딱 하나 아쉬운게..
물이 빠집니다...이런 소재가 물 빠진다는건 처음보는데 진짜 빠짐...흰 티 입고 살짝 땀 났었는데 바로 물들었고, 찬물로 세탁 후에도 한번 더 빠져서 그냥 포기함
안에 입는 티 소재에 따라 빠지고 안빠지고 하는 것 같은데 누가 이너티 소재 골라 입나요...귀찮아 죽겠지만 핏 보고 안고 가요"
yFSaAf1h,,22.10.23,Gray(그레이/쭈리),FREE,정사이즈예요,보통이에요,화면과 비슷해요,152cm,53kg,상의 55,"키 153cm 기준 엉덩이 반정도 가려요.
투웨이 처음 입어보는데 이뿌네요.
처음에 지퍼 올릴 때 잘 안되긴하는데 몇번하다보면 괜찮아져서 입어요."
WIoYTMwu,,22.10.06,Gray(그레이/쭈리),FREE,정사이즈예요,보통이에요,화면과 비슷해요,,,,"요즘 입으려고 기모 없는 걸로 샀는데 두께도 적당하고 예뻐요! 너무 크롭된 것도 싫고 그렇다고 너무 오버핏도 아닌 것으로 찾다가 사게 됐는데 길이랑 크기도 적당해요!! 다만 4만원 가까이 되는 옷처럼 보이지는 않는 것 같습니다,, 좀 아쉽지만 편하게 잘 입고 다닐 것 같아요"
xae4YC1R,상위 30%,22.04.11,Black(블랙/기모),,정사이즈예요,보통이에요,화면과 비슷해요,159cm,59kg,상의 55,"모델분처럼 엄청 이쁜핏은 안나오고요, 길이가 좀 짧아요. 제 키로는 엉덩이 위부분에서 끝나더라고요. 그래도 투웨이 자크라는 점 때문에 좀 유니크(?)하게는 보이는거 같아요 ㅎㅎ 그냥 추울때 홀짝 걸치기 좋습니당"
YroAZwvC,,22.03.03,Gray(그레이/쭈리),,정사이즈예요,보통이에요,화면과 비슷해요,158cm,49kg,상의 66,제 키에는 딱 엉덩이 위까지 왔어요! 쭈리로 샀는데도 털이 장난 x... 뚱뚱한 편은 아닌데 쪼매 몸이 뚱뚱해 보이더라구요... 😢 사진과 핏이 넘 달라서 살짝 당황...했지만 잘 입어는 봐야죠 ㅎㅎ... 플러스로 지퍼 얘기가 정말 많았는데 역시... 조금 싸구려 같기도...
fbfv1PLT,,22.02.28,Gray(그레이/쭈리),,정사이즈예요,보통이에요,화면과 비슷해요,150cm,47kg,상의 44,핏은 딱 이뻤어용 저는 사계절 입으려고 쭈리로 샀는데 조금 흐물거리긴 해용 그래두 너무 편하구 이뽀용 근데 밑에 자크가 약간 휘어져 있어서 투웨이로 스타일링하고 벗을 때 좀 불편하긴 해여 그래도 만족합니다!
MJcydxP6,,22.01.18,Black(블랙/쭈리),,생각보다 커요,보통이에요,화면과 비슷해요,160cm,56kg,상의 55,"그레이로 구매할까 많이 고민했지만 블랙으로 결정 ❤️
그냥 무난하게 겉옷 안에 입으려고 기모 없는 걸로 구래했어요! 그냥 무난하게 입기 좋아요 굳 !"
dbWvgEHn,,22.01.16,Gray(그레이/기모),,정사이즈예요,별로예요,화면과 비슷해요,171cm,63kg,상의 66,"약간 루즈한 핏 생각하고 샀는데, 딱 맞아서 당황했어요. 제가 키가 있어서 그런거라 어쩔 수 없었던 것 같아서 그냥 입습니다. 소매 쪽 시보리가 생각한거랑 달라서 약간 실망했고, 이 시보리 때문에 입고 있으면 조금 불편합니다. 지퍼 부자재가 그렇게 좋은 것 같지 않아서 조심해서 입고있어요. 그거 이외에는 생각한 기장이고 모자가 낙낙해서 좋습니다."
YnfJYYTK,,22.01.02,Gray(그레이/기모),,정사이즈예요,보통이에요,화면과 비슷해요,165cm,50kg,상의 55,"제 인생 후집이에요ㅋㅋㅋ 저한테 핏 딱 예뻐요
시중에 파는 크롭후집은 항상 너무 짧아서 불편했고 박시핏 후집은 너무 커서 맘에 안 들었었는데 이건 진짜 기장 딱 제 스타일… 상의 좀 커보이긴하는데 제가 이런 핏 좋아해서…ㅎㅎ 다른 색으로 또 사려구요
한가지 단점 꼽자면 지퍼가 약해서 고장 날 것 같다?(이미 한번 나서 고침)"
VFJxzZ2u,,21.12.20,Gray(그레이/기모),,생각보다 커요,아주 만족해요,화면과 비슷해요,157cm,44kg,상의 44,"일반 후드집업보단 좀 짧은 크롭 후드집업이에요
완전 짧은 후드집업이 아니라서 좋았어요
옆으로 좀 벙벙한 핏이고 투웨이라서 연출하기좋아요
지퍼는 살짝 짤랑거리는 소리가 들리긴합니다
살짝 거슬리긴하는데 신경안쓰다보면 괜찮아요"
I4Y9EF5x,,21.12.11,Gray(그레이/기모),,정사이즈예요,보통이에요,화면과 비슷해요,164cm,50kg,상의 55,"지퍼: 투웨이지퍼의 공통된 특징. 끼우기 빡셈.
길이: 품도 길이도 넉넉한 오버핏후드인줄알았는데.. 생각했던것보다 짧음.. 크롭후드 만들자! 하다가 아니야 많이팔려면 크롭은 안돼. 해서 만들어진 누군가의 세미 크롭같은.. 느낌.
두께: 도톰함. 탄탄하고 모자도 얇지않아서 좋음
다만 외투안에 입으려면 패딩만 허용가능.

결론 매일같이 잘 입고있음
애매한 기장감이 신경쓰이는것 빼면."
qpj42uSm,,21.12.09,Gray(그레이/기모),,정사이즈예요,아주 만족해요,화면과 비슷해요,162cm,43kg,상의 55,"기모가 생각보다 부들부들하고 따뜻해용
색도 너무 밝지도 어둡지도 않은 딱 기본 그레이색!
손등을 덮은 시보리?를 원했어서 고민했는데 오히려 짱짱해서 오래입을 수 있을 것 같아 마음에 듭니당!
가성비 짱짱!
다만 아쉬운 점은 자크가 좀 뻑뻑하다는 거ㅜㅎㅎ"
fgcz5T6A,상위 25%,21.12.04,Gray(그레이/기모),,정사이즈예요,보통이에요,화면과 비슷해요,163cm,53kg,상의 55,"톡톡한 소재감이라 첨엔 너무 학생느낌인데?? 햇는데
그 점이 오히려 장점으로 부각되는듯
일단 군더더기 없구 소매가 덜렁거리지 않아서 너무 좋아요"
N6ROIGfE,상위 10%,21.11.21,Charcoal(차콜/기모),,정사이즈예요,아주 만족해요,화면과 비슷해요,156cm,53kg,상의 55,괜히 리뷰 많은 상품이 아닙니다 다 이유가 있으니 이렇게 인기가 많죠..주문했을 당시 주문폭주여서 늦게 받을까봐 걱정했는데 일주일 안돼서 도착했어요 진짜 옷 꾸안꾸룩에 찰떡이고 탄탄해서 질도 좋아요..!!
6tmJgooF,,21.11.14,Charcoal(차콜/기모),,생각보다 커요,보통이에요,화면과 비슷해요,,,,따뜻하고 색감도 좋은데 와 어마어마한 어깨깡패가 됩니다... 그리고 산지 10일 지났는데 지퍼가 고장났어요ㅠㅠ 오픈해서 입어야 할 것 같네요.. 그래도 패딩조끼랑 입으면 어깡 방지할 수 있어서 같이 입으려고요..ㅎㅎ
66sbhxqe,상위 30%,21.11.05,Gray(그레이/기모),,정사이즈예요,보통이에요,화면과 비슷해요,156cm,59kg,상의 66,"제 키가 156인데 길이가 생각보다 짧아서 당황했어요.
키 큰 분들한텐 크롭에 가까울 거 같은데..
폭은 여유있게 넉넉해서 좋아요^^"
Uuoyniz,,21.11.04,Gray(그레이/기모),,생각보다 커요,아주 만족해요,화면과 비슷해요,163cm,59kg,상의 66,딱 봄 가을 겨울 모두 입을수 있는 후드집업이라 좋은거 같아요! 기모도 너무 두꺼운게 아니라서 아우터 안에다 입어도 괜찮을거 같구요 163cm에 이쁜 기장입니다 꼭 사세요!!
miKZoTaD,상위 30%,21.11.04,Gray(그레이/기모),,정사이즈예요,보통이에요,화면과 비슷해요,,,,주머니에 휴대폰이랑 지갑 정도만 넣어도 뒷 부분이 들뜬다고 해야되나..? 좀 많이 올라가요 그치만 기모라 부들부들 하고 편하게 입기엔 좋아요!
미니하지않은미니,,21.11.04,Charcoal(차콜/기모),,생각보다 커요,보통이에요,화면과 비슷해요,171cm,55kg,상의 55,"키가 커서 그런지 기장감이 애매한데
그런대로 레이어드해서 입으려구요
차콜 색감 괜찮고 기모도 따땃하니 부드럽고 좋아요
후드 모자핏도 괜찮아요
우려하던 지퍼는 신경 별로 안 쓰여요
핏이 조금 가오리핏,,,,으로 박시한게 아쉬워요ㅜ"
2crolHrB,,21.11.03,Charcoal(차콜/기모),,정사이즈예요,보통이에요,화면과 비슷해요,170cm,53kg,상의 55,"솔직히 좀더 두께감 있는걸 기대했는데 생각보다 얇아서 아쉽고 지퍼도 싼티나요ㅠ
차라리 가격 좀 더 올리더라도 퀄리티를 높이시는게 어떨지…후기가 많길래 너무 기대했나봐요. 걍 싼맛에 한철 입기는 좋아요."
FtmzwuSJ,,21.11.03,Gray(그레이/기모),,정사이즈예요,아주 만족해요,화면과 비슷해요,161cm,51kg,상의 66,"아무래도 털이 들러붙는 건 어쩔 수 없는 거겟죠 ㅠ
한번 빨면 괜찮아질거라 믿어용
핏이나 전체적인 기장 전부 맘에 들어요
굿굿 전부터 맘에 담아두고 잇엇던 건데 드디어 삿네오 ㅎ"
